title,review
이상한 나라의 수학자,포레스트를 찾아서   
이상한 나라의 수학자,딸에게 보라고 권유하고 싶은 영화입니다  수학을 깔고 감동을준 휴먼드라마 
이상한 나라의 수학자,최고입니다  감동
이상한 나라의 수학자,그정도 감동    
이상한 나라의 수학자,그냥 늘 그러한 감동 주는 영화   아주 좋지는 았지만  그냥 저냥 나쁘지 않고 괜찮은 영화   가족끼리 보면 좋겠네요 
이상한 나라의 수학자,감동적으로 봤습니다 왜그리 눈물이 나던지      
이상한 나라의 수학자,재밌네요 코로나만 아니면 더 크게 흥행에 성공했을텐데 아쉬운 영화네요
이상한 나라의 수학자,아름다운 수학  아름다운 영화 
이상한 나라의 수학자,잘만든영화네요 연기도 즣고요 줄거리도 좋고요
이상한 나라의 수학자,인생의 답
이상한 나라의 수학자,최민식배우는 역시 날 배신하지않았다 넥플릭스에   이상나라의 수학자  제목을 보면서  수포자로써는 감히 보고싶지도 않은 제목이였는데 날 감동 시켰다
이상한 나라의 수학자,진리와 정의  삶의 가치관을 생각하게 하는 명작    출연 배우들의 명품연기에 감동      
이상한 나라의 수학자,뻔한 스토리는 처음부터 예상했지만 각 스토리가 연계가 너무 엉성함   가볍게 보기 좋은 영화 나는 최민식 연기 보는 맛으로 끝까지는 보았음  주제의식을 전달하기 위해 짜집기한 느낌 
이상한 나라의 수학자,싱겁다면 싱겁고 재밌다면 재밌을 수 있는 영화  배우들의 연기력이 좋았다  과거의 동감대가 있어 기억을 떠올리며 재밌게 봤다 
이상한 나라의 수학자,마음이 따듯해지는 영화 
이상한 나라의 수학자,요즘 이런 따뜻한 스토리 보기 힘든데  기분이가 말랑해지는 참 잘 만들어진 선한 영화  가족 영화로 쵝오
이상한 나라의 수학자, 파인딩 포레스터 를 안 본 사람들이 많나보네요 문학을 수학으로 바꾼 거 빼고는  전체적인 구성과 플롯이 복붙이네요 범죄수준임 불우한 청소년  위대하지만 까칠하고 사연있는 멘토  억울한 누명 마지막 반전     똑같은 구성임  마지막 단상에 나오는 장면 마저 복붙인데 어떻게 이렇게 수준 낮게 베꼈을까요 
이상한 나라의 수학자,후반부가 많이 아쉬웠지만  괜찮았다 
이상한 나라의 수학자,좋아요
이상한 나라의 수학자,  부족함 결말이 아쉽다
이상한 나라의 수학자,초반에는 재미있었으나 후반으로 갈수록 설득력 없는 감상적 서사에 실망 
이상한 나라의 수학자,수학을 매우 좋아하시던 우리 아버지께서 한창 공부중이던 제게   여년전 제게 해주신 말들이 참 많이 나오네요     전 이 영화를 제 아이들에게 보여주렵니다 잘 봤습니다 
이상한 나라의 수학자,감동적인 영화네요    배우들 연기도 너무 좋았고
이상한 나라의 수학자,연기  내용  의미 다 좋은데 유치한 음악이 영화 전체를 신파극으로 몰아넣는 느낌  음악감독의 중요성을 깨닫게 해준 영화 
이상한 나라의 수학자,우리나라 수학 교육 수준에 일침을 가하고  순수학문의 중요성을 높이는 데 큰 공헌을 할 것 같은 영화  파이의 연주곡 너무 인상적이었다   현실로 돌아가고 싶지 않게 하는 영화   용기가 필요해 
이상한 나라의 수학자,수학에 대해 다시 생각해보게되는 멋진 영화네요 
이상한 나라의 수학자,정말 감동적인 영화  입시 위주의 현 사교육의 문제점도 교묘하게 비판하는 영화  안 본 사람 꼭 없어야 하는 영화 
이상한 나라의 수학자,많은걸  깨닫게 하는 영화입니다    
이상한 나라의 수학자,힉문을 대하는 자세의 진중함과 입시위주의 교육의 경박함을  자극적이지 않고 잔잔하게 이야기하고 있습니다   마지막에 신파적인 내용만 좀 덜어내면 더 좋았을것 같습니다
이상한 나라의 수학자,잔잔한 감동이 있습니다 
이상한 나라의 수학자,최민식  짱
이상한 나라의 수학자,   점 사이 점수를 주고픈 영화  최민식과 조연배우들의 연기가 좋았고   박병은과 김원해  파이로 피아노 합주하는 장면이 가장 기억에 남는다 
이상한 나라의 수학자,이런 교육을 합시다  수학이 좋아서 수학을 하는
이상한 나라의 수학자,감동은 강요가 아니라 느껴야 하는 것 
이상한 나라의 수학자,코로나만 아니었더라면 상당한 흥행을 했을듯 시대를 잘못탄 수작이네요  최민식배우님은 어떤역할도 다 소화하시네요 연기장인이십니다
이상한 나라의 수학자,처음 재미있던 영화가 중간에 변조가 된다 학교와 수학의 이야기에서 탈북과 이념의 이야기로  그리고 마지막을 잘 다듬었으면 했는데 너무 갭이 커서 공감을 갖지 못한다  욕심이 많았던 영화
이상한 나라의 수학자,지금 보고   죽은시인의사회가  여인의 향기인가  잘 편집 했네요
이상한 나라의 수학자,좋은 영화 만들어주셔서 감사드리그 역시 최민식 님은 최고입니다  김동휘  조윤서 님도 너무 예쁘고 최고의 배우가 되실거라 생각됩니다  
이상한 나라의 수학자,최민식 데려다 놓고 이런 영화를 찍었다는 게 아쉽다    감독의 학교에 대한 이미지가 과거에 머물러 있어  학교와 교사  학생에 대한 묘사가 거의 환타지 급이다    탈북한 세계적인 수학자가 학교 경비를 하고 있다는 설정은 설득력이 떨어지고 극의 전개 또한 엉망이다    최민식이 단상 위에 올라오는 장면에선 그냥 제대로 망할려고 하는 구나 싶었다    이 정도면 한국 영화를 좋아해온 관객들을 무시하는 수준이라고 여겨진다       로 본게 참 다행이다 
이상한 나라의 수학자,사람들의 댓글처럼 저도 아들에게 보여주고 싶은 좋은 영화네요 
이상한 나라의 수학자,답보다 과정이 중요하다고 맨날 딸아이한테 했었는데     영화대사에 나올줄이야   
이상한 나라의 수학자,아   나도 수학 문제 풀고 싶다  수학 시험도 보고 싶고  
이상한 나라의 수학자,가족과 같이 봤는데 정말 아름답고 따뜻하고 희망적인 영화였어요
이상한 나라의 수학자,수학을 좋아해서 집중할수있었는데 기대보단 좀 부족해지만 좋았어요 다만 한국과 북한 수학자들이 제일 대단한것처럼 나온것이 좀 부끄럽긴 했습니다 그래도 깃뇍의도는 너무 좋았고 감동도 있어요
이상한 나라의 수학자,따숩고 잼나게 봤어요
이상한 나라의 수학자,막판 단상에서 밝히는건 생뚱맞고 작위적인 느낌   다른 방법도 많은데 끝마무리가 아쉽다 
이상한 나라의 수학자,근래에 본 양화 중 최고입니다 
이상한 나라의 수학자,주인공 인성이 글러먹음  반애들에게 괴롭힘 당하는 찐따인데 밖에나가서 술사오다 걸려서 끝까지 혼자한거라고 괴롭힌애들 감싸주지만  그거 혼자 뒤집어쓰는거 뭐라는 여학생 에게는 큰소리침   밖에나갔다 걸린거 보고한 경비 아저씨에게는 니가 보고해서 지가 기숙사 쫒겨난거라고 적반하장에 인민군이라고 멸칭으로 본인앞에서 부름  그러다가 그 경비가 수학에 재능있는거 알고 친한척 하는거 보거 역겨워서 끔 전형적인 강자에는 꼬리말고 약한사람에게는 강한 소인배라 괴롬힘 당하는게 전혀 불쌍하지도 않음   
이상한 나라의 수학자,현시대를 잘반영한듯  캐릭터도 살아잇고
이상한 나라의 수학자,잔잔하면서  감동을  주는 영화 오래만에  보았네요     
이상한 나라의 수학자,오랫만에 최민식배우님연기봐서 좋았어요  몰입감두 좋구 가슴뭉쿨하네요  
이상한 나라의 수학자,북한은 빼고 영화를 만들자 
이상한 나라의 수학자,    
이상한 나라의 수학자,착한영화이긴 한데   
이상한 나라의 수학자,요즘 영화 같지 않은  전체적으로 촌스러운    그냥 행복은 성적순이 아니잖아요  시절에  머물러있는 영화  
이상한 나라의 수학자,너무  재미있네요   넷플릭스에서  또 봤습니다   
이상한 나라의 수학자,최민식 출연으로  점 드립니다 초반에 흥미있다가 갈수록 신파극으로
이상한 나라의 수학자,역시 최민식배우님  최고입니다 
이상한 나라의 수학자,참신함은 부족하지만 전체적으로 따뜻하고 감동적인 영화였습니다 
이상한 나라의 수학자,마지막에 영화적이고  작위적인 단상 장면만 빼고 좋음
이상한 나라의 수학자,내용이 너무 좋아여
이상한 나라의 수학자,매우 흥미로운 줄거리 전개였으나 마지막 스토리 전개가 아쉬웠다  굳이 그렇게 끝내지 않으면서 더 감동적으로 보여줄수 있었을텐데    고작 누명 벗겨주는 의리있는    다시 찍어보세요  그 부분만
이상한 나라의 수학자,순한맛 영화 초등학생 관람해도 괜찮습니다
이상한 나라의 수학자,숀코네리 나오는 파인딩 포레스터와 너무 비슷한 구도
이상한 나라의 수학자,오랫만에 재미있는 영화를 봤습니다  고맙네요    
이상한 나라의 수학자,와 개끝네주네요 피터지고 액션이나 판타지 영화를 좋아하는 저를 몰입하게 믄든 최민식 형님 마지막 연설할때 눈물 타졌네요 최민식이 다함 나머진 후    올해 최고  점 드림
이상한 나라의 수학자,뻔하디 뻔한 클리셰의 영화  그 뻔함을 잘 풀어낸 평범한 수작 
이상한 나라의 수학자,마음이 너무너무 따뜻해지는 영화   다른 어떤 말이 필요없는 정말 좋은영화   명작을 만나 행복했습니다 
이상한 나라의 수학자, 
이상한 나라의 수학자,이 영화가 평점이 이렇게 높다니  내가 최근에 본 영화 중 최악인데       재미 없고 지루함    스토리에 개연성이 앖음    다른 영화 짬뽕  굿 윌 헌팅  여인의 향기  죽은 시인의 사회  뷰티풀 마인드 
이상한 나라의 수학자,배우 좋고  음악 좋고  스토리 좋고  영상도 좋네  영화가 이만하면 됐지  
뜨거운 피,정우  
뜨거운 피,깡패영화 인거 알고 보고 까는건 뭥니 
뜨거운 피,디테일한 인물들의 과거를 알아야 재밌는 영화인데 감독의 역량부족입니다 연출을 기가 막히게 하던가 아니면 과감히 아예 큰줄기 이야기만 끌고 가던가  모든걸 담으려한 과욕이 부른 아쉬움  넷플릭스  부작 드라마였으면 괜찮았을 듯
뜨거운 피,              에휴    
뜨거운 피,감독판으로 봐야 재밌음
뜨거운 피,개연성    연출력이 문제
뜨거운 피,쓰레기  인생들   
뜨거운 피,소설만큼은 아니지만 나름 열심히 만든 재밌는 영화
뜨거운 피,조폭 영화치곤 영화 강릉 김길석만큼 포스가 나는 캐릭터가 하나 없네  
뜨거운 피,무언가 있을듯 하며 없는 스토리로 배우들의 연기력만 볼만한  
뜨거운 피,간만에  재밌게본 느와르입니다 아들역 연기좋구요 다들 연기좋고 생각보다 클리셰도 적어서 재미있습니다
뜨거운 피,그냥 심플하게 갔어야 되는데  점점 산으로 가고 있다 영화로 표현하기에는 너무   
뜨거운 피,소설 그대로 만들었으면 정말 재미있었을텐데   하다못해 감독판을 개봉했으면 이거보단 나았지   
뜨거운 피,주인공이    같은 영화
뜨거운 피,정우는 연기와 눈빛은 항상 슬픈것 같아요  영화에서  많이 보고 싶어요    정우님  많이 연기 해주세요 
뜨거운 피,재미보다는  별로  그러게  집중도로안봤음  그냥그래서
뜨거운 피,생계형 건달들 끼리 나름 심각하다 소박하고 지루한 일상처럼 보이는곳에 심각하고 진지한 일들이 있다   정우의 내면 연기 머그런거 없음    알짜배우들이 많이 나오는데  그냥 감독 부탁으로 카메오로 나오는것 같다  건질거라고는 용강 과 아미   
뜨거운 피,재미없다 조폭영화는 어설프면 너무 시시하고 짛 루하다  임펙트없는 조폭 영화 쓸데없이 모두 다 죽이고 죽는 결론도 그닥 이해안가는  영화
뜨거운 피,식상한 건달영화   근데재미도읎어  시간아깝다
뜨거운 피,마  이기 영화가  시방 머더는거여 
뜨거운 피,개인적으로 조폭 영화를 싫어한다  특히 미화되고 우정으로 포장된 폭력 영화는 경멸한다  조직들이 세를 키워 사업을 하고 기업이 되고 그들이 매니지먼트를 하고 엔터사로 이어지는 스토리  현실이 그렇다보니 우리나라엔 오래전부터  조폭 영화가 하나의 장르가 되어 버렸다   그래서 기준이 애매모호한 작품들이 많다  코미디로 포장된 조직은 대흥행을 하고  친구로 시작된 한국판 느와르는 욕을 먹는다  바람과 신세계는 되도 강릉과 얼굴없는 보스는 안된다  이건 단순히 완성도와 재미의 차이가 아닐까 싶다  이 작품은 딱 그 중간쯤 어딘가에 위치했기에 잘 만들어도 비평의 대상이 되는 것이 아닌가 싶다  정우와 지승현  그리고 멋진 배우들로 만들 작품이 폭력 작품 밖에 없는게 더 아쉬울 뿐이다 
뜨거운 피,영화는 감독이 관객에게 들려주는 이야기라생각한다 당췌 감독이 뭔생각이고 뭔얘기를 하고싶은건지  모르겠다 편집을 하면서도 지도 몰랐을꺼란 생각이다
뜨거운 피,재밌다  뭔가 여운이 남는다 정우 연기 이렇게 잘했나 
뜨거운 피,폄훼될 작품 아니다  특히 김언수 작가의 원작  
뜨거운 피,내용 둘째 치고 정우 연기 잘해서 평점 올리기
뜨거운 피,경상도의 깡패  소재선택 후 아무것도 없다 
뜨거운 피,난 오직 재미로만 평가한다 
뜨거운 피,감독판 봤는데 왜 망했는지 모르겠다  존    잘 만들었는데    극장판이 얼마나 편집이 되었길래 이리도 다르다는 건지    그리고 리플 보면 자꾸 대사 안 들린다는데    난 왜 잘 들리냐  연기도 좋고 사투리도 찰 지게 잘 치는 구만  내가 봤을 땐 사람이 많이 죽어나가서 영화는 감상할 생각도 안 하고 평점만 오지게 깍아 내리는 거 같다  영화를 봐라 니네 고상한 개취 때문에 평점 깍지 말구 
뜨거운 피,신세계처럼 허황되게 번쩍거리지 않아서 좋다  박철수의 학생부군신위처럼 철저하게 리얼하진 않지만 이렇게 거칠게 날것을 묘사하는게 좋다  발음이 잘 안 들려도 좀 더 보니 이해되고   무식한 쌩양아치들 세상이어도 이 정도 계락도 없다면 영화로 못 만드는 거고    그 시대에   범죄와의 전쟁도 과장되었고  비열한 거리도 너무 고상하고  곽경택의 친구도 소설같고   희수와 양도이와 용가이   철찌 가 옛날 길가다가   아니면 국민학교  동기를 만나 술마시다 들었던 딱 그런 아치들이다 리얼하고 거칠어서 좋고  뜨거운 피가 살아 남아 좋다   언제였던가 뜨거웠지만 식어버린 피도 죽었고 뜨거워지지 않았던 피도 제거되었지   몇 년 뒤 환갑이 오기에 미리 늙은이 티를 내었더니 다시 뜨거운 삶을 살아야겠다
뜨거운 피,  점은 아니나  점 받을 작품도 아니라 생각합니다   그 시대 그 분위기 잘 만들고 연기한  나쁘지 않은 영화라 생각합니다  제 생각에는 나쁘지 않은 영화입니다 
뜨거운 피,의외로 평점이 박하네 난 재밌게 봄   시간 지루하지 않았음 단  영감님 어색한 사투리는 옥의 티
뜨거운 피,살아남아도 허무한 삶
뜨거운 피,부산건달 영화는 이제 좀 쉬자  
뜨거운 피,방금  분 봈다 쓰레기 차라리 강릉 낮다
뜨거운 피,조폭 영화 자체가 없어지길 바라는데  온 가족이 볼만한 영화라고 판단 했는지 공영방송에서 추석 특집으로 해주고 자빠졌네 뜨거운게 아니라 더러운 피가 끓어 넘치겠다
뜨거운 피,오랜만에 괜찮은 느와르 영화를 본  거 같아요  배우들 연기도 훌륭했음 
뜨거운 피,배우들의 연기는 좋네요 그래도 킬링타임용으로는 볼만한듯
뜨거운 피,정우를 새삼 돌아보게 만든 영화
뜨거운 피, 
뜨거운 피,좋은데  감성팔이 뺀 하드보일드라 까칠까칠함 올해 하품 안하고 본 유일한 한국영화
뜨거운 피,와  오랜만에  진정한  영화봤습니다 왜이런  탄탄한 구성으로만든영화가  극장에서 빨리 사라졌는지가 의문입니다
뜨거운 피,편집만 잘 했어도   
뜨거운 피,진부하다  
뜨거운 피,재밌다    
뜨거운 피,재미 있습니다  별점테러는 왜지 
뜨거운 피,감독판으로 봤는데 친구 이후로 몰입해서 볼 수 있었던 오랜만에 보는 걸출한 수작이다 
뜨거운 피,간만에 재미난 영화 봤습니다  감사합니다 
뜨거운 피,부족한 부분도 있지만  재밌게 잘 봤습니다 
뜨거운 피,뭔말인지  거지같은 사투리를 알아들을 수가 없네
뜨거운 피,나름 볼만함   마지막 반전도 괜찮고   근데   극장가서 볼 영화는 아님 
뜨거운 피,재밌구만     넘들이 뭐가 재미없냐
뜨거운 피,이 영화는 반드시  감독판 을 봐야한다  꽤 괜찮은 느와르물이고 재평가 받아 마땅하다 평점이 만점을 주기에는 부족할지 모른다만  전체 평점을 올리는데 기여하고자 다섯개 남깁니다 
뜨거운 피,뭐지    강릉 이나  낙원의 밤  이런거 보다 훨 나은데 평점이 왜 이래 
뜨거운 피,시간은 잘 감 걍 흔한 조폭 영화 임
뜨거운 피,엄청 좋았는데 평이 엄청 안좋네     분 재개봉작을 봐야함  원작이 웡캉 워낙 부산 사투리  좋아  물론 천명관 감독 연출도 나름 수준급   친구  이후 오랜만에 등장한 잘만든 한국형 조폭 느와르  원작가 김언수가 고딩 후배였다  흑흑  그래서 더 정감 간다  고향 영도는 늘 악역이다만은  다 보고난 감흥이 너무 좋아 작가를 검색해본  한국 작가들  신춘 문예가 망쳤다는 이야기도 알게되었고  내면 세계만 그려대는 한국형 소설  나도 그런 생각을 많이 했다  다만 그는 직접 글로써 훌륭하게 극복해보였고  형은 아직도 상상 몽상만 하는  원작자의 스토리텔러로써 자질이 웡캉 좋아  영화로까지 잘 전이된 케이스  정우 연기야 두말하면 잔소리 호연  그리고 수많은 캐릭터들  배신 암투 스릴러 요소 다 좋아보이는 
뜨거운 피,   
뜨거운 피,보고 싶었던 작품인데 하도 여기서 개연성 악플이 많아서 버티다가 디오리지널로    관람함 결론은 한시즌짜리라도 현재 배우들 그대로 드라마로 만들면 느와르 드라마 수작이 될 작품임 이런 건달 에픽일대기를  시간에 욱여넣느라 디오리지널 기준으로도 좀 터져나온 부분이 있긴함 그러나 모두 감안해도 배우들 연기는      이후로 최고라고 생각되고 분명 잘 만든 느와르인건 분명함 확실한건 강릉 따위랑 비교불가이고 개인적으로  점 주고 싶은데 테러충들 보기싫어서 만점 줌   
뜨거운 피,생략이 심해서 스토리가 이어지지 않는다 게다가 윤제문이라니 미친  그나마 살인의 눈빛으로 돌변하는 정우의  연기는 좋았다 뻘밭의 하나의 진주같은 존재 하지만 조폭 영화는 그만 찍었으면
뜨거운 피,완전 재밌는데 평점이 호불호가 극명하게 갈리네
뜨거운 피,숙면영화   불면증 한방해결됨
뜨거운 피,재밋구만   질 할들이네
뜨거운 피,잘 만들었구만    들이야 
뜨거운 피,실망
뜨거운 피,초반 스토리와 연출이 너무 심각하다  반도 못보고 꺼버렷다 
뜨거운 피,집에서  결제하고 보는데  아니  사투리땜에 대사 전달이 안되니까 몰입도도 떨어지고 재미가 없어요  드라마에서 부산사투리는 이정도는 아니라 대충알아들었는데    뭔말인지 말도 빠르고 모르겠어요
뜨거운 피,저는 재밌게 봤는데
뜨거운 피,    년     년말인가  노태우가 범죄와전쟁 선포할때 그때요따구로 치한이허술햇엇나   영화중반까지 경찰전개부분할때까지만나오고 전혀않나왓다 극중인물 희수 가경찰 정보원 인줄알앗음 조직뒷처리에 키우는애들 돌보고 박회장인가 그꼰대따까리노릇에 지금까지본 정우 주연영화 중제일역할이많네 하찬고 찌질한일들을 과대하게 포장하다싶게 만든각본이 별로임 원작그대로 영화한건아닌거같음 뭐 연기는괜찬고만 범죄영화 액션만보는 초딩 얘들평점 보다생각난게있어글올렷다
뜨거운 피,어찌  나이트에서 오디오정글이라는 라이센스   워터마크가있는곡이 나오는지 원   
뜨거운 피,개인적으로는 재밋게 봤습니다 
뜨거운 피,스토리가 너무 산만 그리고 정우 눈물 핑도는  연기 너무 남발 장면이랑 안맞던데 왜그러지
뜨거운 피,조폭 영화  잘 봤습니다 
뜨거운 피,잡동사니  르와르  깔끔하지가않다 많은걸 보여주려고하니  관객으로써는 지루하기 짝이없고  재미가 없다
뜨거운 피,디 오리지널 넘 재밌게 봄  
뜨거운 피,나름 볼만했는데  진짜 대사 전달력은 꽝  뭔 말인지 정확히 들리지가 않음   한국인 영화인데 자막이 필요한 경우
뜨거운 피,수면제 대용 화면   끝
뜨거운 피,아니 솔직히 조폭 다룬 영화는 이 정도 기대헀던 것 아닌가  뭔 놈의 기준들이 이리 높은지 
뜨거운 피,많이 봐 오던 그런 조폭 영화 궁금한것은 왜 죽이지 않고 살려둬서 나중에 사건을 만드는지 모르겠네 자신을 죽이려 했는데 당연히 복수하려 하지않을까 
뜨거운 피,고마 만들어라 마니 무따 아이가   
뜨거운 피,이도저도  아니게  찍었네요  내용도  연출도  액션도  형편없네요  사투리   못하면  그냥  표준말쓰자
뜨거운 피,정우 겁네멋있다  
뜨거운 피,댓글쓴사람들 영화 전부다 보긴봤나  의외로 재미없다고 하길래 기대안하고 봐서 그러나     난 나름 갠춘   
뜨거운 피,그놈의 후까시
뜨거운 피,완성 덜 된 작품 내놓고 확장판이라면서 두 번 개봉하는 짓 좀 하지마라
뜨거운 피,스프없는 라면 먹은 기분    그리고 전체적인 내용이스무스하지가 않고 단락씩으로 끊어지는 느낌이고   배우들의 연기또한 오바스럽고 느끼하게 느껴지는것이    많이 아쉽습니다   뭐   피칠갑에 칼과 몽둥이가 난무한것만이 느와르는 아니지만  이게   우유부단한  인자의 보스되기 일일일기 같은 느낌임        주연배우 정우의 연기는 나쁘지 않네요  
뜨거운 피,평점땜시 글쓰기좀글치만 나는 그런대로 재밌게봤네그려
뜨거운 피,한국에서 높은 평가를 받는 느와르 장르의 영화들 역시 클리셰를 상당 부분 차용하고 있으며 클리셰 자체는 영화를 평가하는 것에 있어 부정적 요소가 될 수 없다  영화의 배경은 과거지만  우정이니 의리니 하는 남자들의 진득한 감정을 과도하게 내세우는 유형에서도 어느정도 벗어나 있어 낡지 않게 느껴졌다  생략된 부분이 많아 이해가 어려운 부분들이 있고 이야기 자체가 밋밋한 것도 사실이다  사투리 대사를 알아듣기 어려운 것 역시 영화의 단점이다  하지만 매너리즘에 빠져 인생을 소모하던 중년의 남자가 손에 피를 묻혀야만 더 높은 곳으로 향할 수 있는 삶을 받아들이고 그 과정에서 피가 한 방울도 섞이지 않은 혈기왕성한 청년을 자식으로 받아들인다는 서사는 퍽 매력적이었고  지나친 감상주의로만 빠지지 않은 연출도 좋았다 
뜨거운 피,연출과 편집의 실패
