title,review
모비우스,재미도 없고 액션도 없고 신선함도 없다  도대체 뭐야
모비우스,별 기대안했는데 재밌네  엔딩보니  탄도 나오려나보다  
모비우스,마블도 이제  한물 간듯
모비우스,평점조정
모비우스,예고편으로 관객을 낚은영화   영화 함 봐보셈   이건 진짜아님
모비우스,허헐   주성치 영화  손오공 서유쌍기   월광보합 편에서 잠자는 사람들의 음기를 빨아먹는  흑성요괴  라고 했던가    걔하고 좀 닮았네    
모비우스,마블영화에 비하면 너무 밍밍하네   볼거리도 생각보다는 미흡하나 볼만하다 
모비우스,재밋게봣어용   편 또 나왔으면 좋겠네여  
모비우스,재밋기만 하구먼  악평이 많네요
모비우스,진짜 베트맨이 나타났군   영화 잘만드네 
모비우스,볼만하지만  스토리가 뭔가 엉성하고 느닷없어서 당황스럽다
모비우스,어떻게     년에 나온 언더월드보다   가 후질 수 있냐      년에 영화 줄거리를 이따우로 만들어도 제작비를 받아 낼 수 있는 거야  이 영화는 마블유니버스랑 아무 상관 없는 걸로 이런 대배우들 데려다가 겨우 이런 연기 시킨 감독은  이 작품을 끝으로 영화계를 은퇴해야 맞을 듯하다 
모비우스,처음 시작은 그럭저럭  참신함도 없고    지루하다 
모비우스,      이걸 영화라고    
모비우스,엔딩에서  편을 예고하던데 안간다  무료티켓 보내지마라  재미없는 영화
모비우스,흔하디 흔한 전개와 스토리와 연출   그 이상의 점수를 주기는 불가능하다
모비우스,개폭망 영화최악
모비우스,충분히 있을만한 스토리네요 시간순삭입니다
모비우스,주인공이 매력적이지 않을뿐   는  그런대로 봐줄만했다
모비우스,그럭저럭   킬링타임용 에   그치는군
모비우스,개연성도 없고  언제끝나지 기다리게되는 
모비우스,기대안했는데 재밌네요 텐링즈의전설보다    배남
모비우스,자레드레토는   대인데 어쩜 저렇게 안늙는지 모르겠다   이 영화 완전 좋은건 아니나 그렇다고 마구 까일 영화도 아니다 
모비우스,   
모비우스,이  영화는 역대급이다      년도 영화중 최고다 
모비우스,초반부터 중반까지는 상당히 흡입력이 있다  하지만 뒤로 갈수록 식상하고 대충 마무리가 된다 
모비우스,좋은 배우와 멋진 연출 하지만 진부한 스토리와 뭔가 찝찝한 마무리  영화를 보기전까지 주인공이 이렇게 잘생긴 배우인지 알지 못했습니다  연기력도 좋았구요    범벅이지만 이정도는 영상의 화려함과 재미를 주기에 좋았다고 생각이 들었습니다  하지만 전개가 별로이고  사건간 개연성이 너무 적다는게 문제  박쥐하나의 유전자를 조합했다고 사람의 구조적인 모습이 쉽게 바뀌지 않습니다   너무 과도한 분장이 영화를 망친기분    년도 영화 드라큘라에 비해   만 화려하지 전체적으로 수준이 떨어짐  빌런인 루시안을 제외하고 인물들의 특징이 크게없다는것도 많이 아쉬움  화려한  를 둘렀지만 큰 임팩트가 없음  마지막 싸움마저도 이게 뭐지  할정도로 어이없게 끝나는것도 문제 
모비우스,딱     년 초반 수준의 연출임   그닥 비추네요   
모비우스,나는 왜 졸릴까   다음편은 좀 괘안아 질런지   
모비우스,스케일이 조그맣다 베놈 같은 마블내 마이너 느낌
모비우스, 편을 반만 보여준 느낌  속편 노림수가 지나친   
모비우스,개판
모비우스,그리 인상적인 시작은 아니올시다
모비우스,언제 나올지 모르겠지만 후속작이 기대되네요 주인공 넘나 멋있음
모비우스,화면도 개어둡고 머가먼지정신없는영화였고이터널스랑견줄만한   노잼영화
모비우스,  를 잔상으로 처리해서 보기가 너무 불편하다   
모비우스,재밌다  화려면 영상과 액션만으로 볼만하다  요즘처럼 쓰레기 영화 홍수속에 돋보이는 평작
모비우스, 모비우스  라는 캐릭터에 큰 매력이 느껴지지 않지 영화는 잘 만든 거 같음 배우도 좋고
모비우스,스토리가 너무 단순하고 빈약하다  스킬도 단조로움 
모비우스,내용에 당위성이없다  그저 죽이고 빌런도 타당성이 없다 왜싸우는지 모르니 화면이 화려해도 지루하다
모비우스,지들이 고용하고 같이 일하던 용병을  명이나 죽여놓고도  용병이란 이유로 그거 죽인건 노카운트라니    참 편리한 윤리관이네요   명 죽인 살인자가 좋은사람인척 하는 쓰레기 영화
모비우스, 
모비우스,낡은 카드
모비우스,식상한  혹은 닳고 닳은 전개로 끝나지만 오래된 것을 새로운 방식으로 보여준 것이 참신했달까    이 장점은 감독의 역량인가 배우의 능력인가 
모비우스,자레드 레토가 그나마 살렸다
모비우스,시작은 제법 그럴싸 하더니만 갈수록 없는 밑천 드러나는군            
모비우스,아     올해 처음으로 중간에 보다가 나왔습니다 
모비우스,캬  캬  만 하다가 영화 끝남
모비우스,새로운 게 없다  진부하다 
모비우스, 
모비우스,재미있긴 하지만 떨쳐낼수 없는 찝찝함   
모비우스,별 하나도 아깝다
모비우스,난 베놈보다    배 낫더만   앞으로 펼처질 이야기의 소재가 다양하겠어
모비우스,초반부  점 중반부  점 후반부  점 쿠키영상 죽음
모비우스,어정쩡한 정체성처럼 잔상만 흘러넘치네
모비우스,수어사이드 스쿼드 모비우스    자레드 레토가 참여하면     마블  모두가  초토화
모비우스,이영화는   의 화려함이   볼만하지만  어지럽다   스토리전개도  뻔하고  그냥 마블의 블랙히어로 탄생설화 
모비우스,재밌어요 
모비우스,분위기는 엄청 진지하고 스토리도 나쁘지 않은데  쓰잘떼기없는    로 보기싫었고 오히려 현실감만 떨어짐  액션에서 계속 졸음 악당역은 그냥 인간쓰레기로 왜 주인공을 공격하는지 이해가 안감 불면증 있는 분들께 추천드립니다
모비우스,친구가 카이저소제도 아니고     
모비우스,우리가  아는 흡혈귀 이야기에 마블과 소니가 데코레이션을  넣었다 한마디로  우리가 아는 뻔하디 뻔한 흡혈귀 이야기 그러다 보니 스토리는  한숨만 나온다 그냥   로 떡칠된 엑션신 만이 우리의 기대를 만져줄뿐  에휴
모비우스,앞으로 어떻게 진행 될런지 
모비우스,뭐지 이건   
모비우스,뻔한 히어로물도 캐릭터를 잘 조합해서 매력있게 만드는 마블의 능력이 드디어 한계에 이르렀나  저 좋은 배우들을 데려다가 왜  하는 생각만 나는 작품  보는 내내  쟤 왜저래  라는 생각이 드는 전개  속편이 걱정이다 
모비우스,나름 생각보다 재미있게 봤네요   이렇게 눈이 즐거운 영화가 재미 없다고하면 예술영화나 봐야죠
모비우스,킬링타임용으로는 좋다
모비우스,의외로 매우 진지 하고 음향도 좋고 연기도 좋고  
모비우스,겁나게 재미있었습니다
모비우스,기대안하고 봐서 그런가  너무 재밌게 봤음  담편 기대되요    어글리  하지만 매력적인 빌런  베놈이랑 비슷한 느낌이긴 하지만 또다른 매력이 있음  
모비우스,재미없어요 
모비우스,아    마블 예측가능한 단순한 스토리   로 덕지덕지 발라버린 클라스 이 어둔 분위기를 스파이더맨과 연결시킨다고  차라리 베놈과 콜라보해라
모비우스,별   개 정도는 아니다  나름 볼만하더라  연기는 확실히 잘해 스파이더맨 괴롭히려는 빌런또하나추가네  
모비우스,음      영화가 많이 엉성합니다
모비우스,기대를 안해서 그런지 재미있게  봣어요   극장에서 봐야 될 영화인듯   코로나로 인해 간만에 가서 더 좋았는지도  
모비우스,소니영화는 별로네
모비우스,새로운 캐릭터에 대한 신선함만 있을뿐 모든 내용이 거지같다    급전개 급발진 무리수 범벅
모비우스,너무낮은거같아서 실제별은    점정도 주고싶네요 평이너무안좋아서 별로라는걸 베이스로 깔고봐서 그런가  나쁘지않게 봤습니다  베놈 편을 재밌게보셨으면 재밌게보실듯 합니다  베놈 와 이터널스보단 낫습니다   개인적으로 베놈 을 재밌게본지라    기준을 베놈 로 두시고 볼지 말지 판단하시면 좋을듯
모비우스,  
모비우스,스토리는 말이되는 시작입니다  그럴수도 있는이야기다 근데 화면이 너무 마블영화다 이제는 마블의영화가 지루하게 느껴지기 시작하네요 단돈 만원에 보는거만  마블의 영화에 실증이 느껴지는 영화이구 다음 마블영화를 봐야할지 고민하게 하네요
모비우스,재미좋던데
모비우스,저는 시간 가는 줄 모르고 빠져서 봤는데 왜 이렇게 악평이 많을까요  코로나 시기에 이런 장르의 영화가 오랜만이어서인지 정말 재미있었습니다  무조건   범벅인 영화가 아니어서 더 좋았어요  그리고 자레드 레토도 멋져요 
모비우스,이토록 실용적인 영화라니
모비우스,꿀잼 자레드짱
모비우스,초중반부터는 괜찮음 후반부서는 끝이 허무하네  
모비우스,지루해서 사망할뻔   
모비우스,거미인간을 기다리며
모비우스,액션이라고 볼만한 것들은 예고편에서 본게 전부이고 알아볼수 없는 영상  구분안되는 주인공  형편없는 얼굴 변형    뱀파이어 소재로 이렇게 지루하기 짝이없다니  마블 소재로 소니에서 만들었는지 이렇게 엉망이다니 이터널스 이후로 다시한번 실망스럽네요
모비우스,스파이더맨 이    빌런 이  제일   많은가  배트맨이  빌란이   제일  많나   검색  해  도  양이  많아서  눈  아픔
모비우스,러닝타임이 짧아서  다행 스핀이더맨 아류도 아니고  이걸 영화라고 만든건지
모비우스,분명 마블 영화인데    같은 다크함 좋네요 전 개인적으로 재미있게 봤습니다
모비우스,재밌음   배트맨보다 쎈 박쥐히어로   베놈에 비하면 그리 다크하지도 않고 재밌게봤습니다
모비우스,아무리 공짜티겟이지만 잠만 잣음
모비우스,하    소니의 마블 유니버스는 진짜   
모비우스,영화 러닝타임이 짧아서 그런가 스토리가 부실했어요 그래도 배우들이 연기를 잘해서 그나마 멱살잡고 끌고간거같은데 굉장히 아쉽네요 액션이나 그래픽은 엄청 공들인거같았어요
모비우스,제평점은 별 개 재미없습니다
모비우스,베놈보다 재미 있네요 
모비우스,아쉽지만 볼만함 통신사 공짜표 감솨
모비우스,기존 아이언맨 캡틴아메리카 어벤져스등을 너 무 재미잇게 본분들이라면 실망할겁니다 
모비우스,초중반까진 나름 쫄깃한 진행이더니 막판은 영    
모비우스,부실한 스토리와 부족한 완성도  파워 밸런스 붕괴 등이 아쉽지만  빠른 진행과 화려한 영상  그리고  개의 쿠키가 최소한의 즐거움을 보장해 준다 
모비우스,잘잤습니다
모비우스,좀 불친절한 영화다  개연성을 꼼꼼하게 보여주지는 않는다  그래도  폭망할 정도의 영화는 아니라고 생각은 듬  나름 볼 만은 하단 얘기  짐 캐리의 마스크를 보신 사람이라면 그 캐릭터를 충분히 기억해 내게 될것이다 
모비우스,구미호 보는줄
모비우스,잼나게 보았는데 도입부와 결말부분이 좀 엉성하고 전체 흐름과 연결이 안되네요  주인공 멋져요  연기짱
모비우스,다크 무비를 지극히 좋아하지 않는 관객을 제외하고 무척 재밌게 볼 수 있습니다  전개도 빠르고  약간 어지러운 정도지만 비주얼효과도 괜찮은 것 같습니다  멀티 유니버스와 관련된 스파이더맨과 대결이 후속작이 될 듯   
모비우스,일단 어찌 탄생했는지는 알았고      배트맨 트라큐라 구만         스파이더맨하고 붙는 다음편을 기대하며    
모비우스,구성은 갖추어져 있으나 스토리가 아쉽고 영화의 진행속도가 빠르다  마블을 즐겨보던 사람으로썬 샹치보다 못한것 같아 아쉬움이 컸다 
모비우스,피로 부활한   세기 블레이드 버젼 화려한 영상과 퍼포먼스는 충분한 킬링무비로 손색 없다
모비우스,재밌어요 마블영화인데 주인공 연기도 쩔 었음
모비우스,보다가 졸았네요    
모비우스, 
모비우스,흡혈 야수의 대결이 인터벌 리듬을 타며   음향고조를 반복하면서 긴장과 이완  악과 선의 마음이 요동치며 흥미를 자아낸다    쿠키  
모비우스,오래 기다린 보람이 있엇다   개봉하자마자 달려가서 봤는데 역쉬     개짜릿함
모비우스,역시 믿고보는 자레드레토    
모비우스,쿠키 꼭 봐야함    앞으로가 더 기대됨 
모비우스,   분 순삭  쿠키 영상  개 제대로 떡밥 던짐
모비우스,개봉하자마자 보고 왔다  진심 오랜만에 제대로 된 액션 히어로 영화 보고 온듯   이터널쓰땜에 뚁땽했던 마음 모비우스로 치 유 
모비우스,베놈을 재미있게 봤다면 괜찮은 
모비우스,별로 기대 안됨 노잼
모비우스,베놈의 후예 같은 모비우스꼭보러 간다 근데 베놈이랑 모비우스랑 싸우면 누가 이기지 
모비우스,미국판 다크히어로
모비우스,케빈 파이기             없는 영화는 앙꼬없는 찐빵 
모비우스,굳일거라고믿는다
모비우스, 월로 또 연기  연기같은 모비우스 는 연기만해
모비우스,    
모비우스, 조커  자레드 레토의 주연의 영화라니 기대가 됩니다  
모비우스,우리 피빨이 또  월 일로 연기됐네   
나의 히어로 아카데미아 더 무비: 월드 히어로즈 미션,원작을 안 봐서 그런진 모르겠지만 조금 지루했다 
나의 히어로 아카데미아 더 무비: 월드 히어로즈 미션,굿
나의 히어로 아카데미아 더 무비: 월드 히어로즈 미션, 
나의 히어로 아카데미아 더 무비: 월드 히어로즈 미션,꿀잼
나의 히어로 아카데미아 더 무비: 월드 히어로즈 미션,특별관에 대한 광기는 점점 커져만 간다   아맥이든 포디든 열어주라  
나의 히어로 아카데미아 더 무비: 월드 히어로즈 미션,액션 연출이 좋아요
나의 히어로 아카데미아 더 무비: 월드 히어로즈 미션,극장판 존잼   
나의 히어로 아카데미아 더 무비: 월드 히어로즈 미션,스토리 개연성이 중요한 이유  나히아 극장판은 하나같이 스토리가 영 별로임  미도리야는 스파이더맨인 줄
나의 히어로 아카데미아 더 무비: 월드 히어로즈 미션,너무 궁금하다      
나의 히어로 아카데미아 더 무비: 월드 히어로즈 미션,설득력이 없는 악당이 된 이유
나의 히어로 아카데미아 더 무비: 월드 히어로즈 미션,드디어 개봉     극장가서   번 본다
나의 히어로 아카데미아 더 무비: 월드 히어로즈 미션,드디어 나오는구나
나의 히어로 아카데미아 더 무비: 월드 히어로즈 미션,나의 히어로 아카데미의  극장판 만화    진심으로 기대됩니다  너무나도 사랑해요   
블랙라이트,리암이  무명배우들 키워줄려고 봉사 하는줄  스토리도 흔한   마무리는 무슨 건너뛰기 한줄 
블랙라이트,좋다 리암의 액션은 늘 가볍지않고 깊이가있고 재미도있다
블랙라이트,본리시즈의 하하하위 버전   요상한 헤어스타일의 기자는 딱히 하는 일도 없고  급결말이 당황하게 하네 
블랙라이트,리암 형님 이제 은퇴하셔야할듯   
블랙라이트,리암 니슨이 주인공이여도 너무나 지루한 스릴러 전개  
블랙라이트,이미 다 써먹었던 흔해빠진 설정과 재탕  삼탕   이보다 더 지루할 수 없다   
블랙라이트,힘없네   
블랙라이트,평범한 음모론에 평범한 액션 영화 너무 예측 가능해서 아쉽다 테이큰을 다시 해석한 듯한 영화
블랙라이트,이게 뭔가 리암할아버지 액션은 은퇴하셔야할듯 액션이 총쏘는게 다 내용은 너무 허술해서 실소가  전작도 망작인데  이건 그냥 리암 돈벌게 해주려고 만든듯 액션은 이제 후배들에게 양보하심이
블랙라이트,리암니슨이라는 장르를 만들어낸 거장의 끝물  가족의 복수로 한시대를 풍미했던 리암니슨의 가장 초라한 액션물로 꼽을 작품이다  각본은 있으나 마나한 수준으로 여전히 가족을 부르짖고  등장인물들의 직업 설정이나 행동은 허술하기 짝이 없다  연세가 있으신 만큼 몸으로 하는 액션 연출은 따로 천천히 합을 맞춰 찍은 듯이 뚝뚝 끊켜 편집되었다  이제 리암니슨도 액션물 주연의 욕심을 내려놓고 가족드라마나 액션물의 보스급 조연 정도로 영화를 빛내주시는게 어떨까 싶다 
블랙라이트, 
블랙라이트,박수칠때 떠났어야   
블랙라이트,작품의 마지막이 아쉽네요  그것 빼면 좋았던 작품 
블랙라이트,리암 형님 나이가 있어서 액션도 안되고 달리기도 안됨   세월이 야속하지만 다른 장르에서 계속 봤으면 함  
블랙라이트,리암 형이 연로하신 나이에도 불구하고 나오셨다   이 또한 반갑지 아니한가  싸가지없는 것들이 늙었다고 대배우를 너무 괄세하네   니들은 안 늙냐 
블랙라이트,아     뭐지   리암옹의 영화가 갈수록 허술해지고있다   테이큰류 영화는 이젠 작별하시는게 어떨까요  찾아서 죽인다는 대사는 왜 나온것이야 짠하다     안보신분들 낚이지 마시고 거르라고  점 줍니다   액션은 작별하고 드라마로 가셔요 아님 심리 스릴러로 가던지  
블랙라이트,  
블랙라이트, 
블랙라이트,이제 보면서 안쓰러운 느낌마저 들지만 이것은 끊을 수 없는 마약 같은 느낌이랄까  
블랙라이트,초반 댓글   점들 너무 하네요  예전에 회사에서 단체로 영화 보러 간 적 있었는데 기획팀 직원이 댓글 평 보고 선정했다가 직원들한테 욕 바가지로 먹었음  대표가 영화 끝나고 나오면서 왜 이런 영화 선정했는지 모르겠다라고 고개를 절래절래 흔들었다  영화 보고 평이 궁금해서 들어와 봤는데 예전 생각 나서 처음 댓글 달아 봄 
블랙라이트,설마설마 하면서 끝까지 모두 봤다  정말 내 눈을 의심하지 않을수 없었다  이런 내용과 액션이 리암리슨의 영화가 맞는가 하고 말이다  딸바보 내용은 이제까지 항상 있어왔던 스토리라서 그려려니 했다  액션보고 깜짝 놀랐다  할아버지 장기둘 힘도 없어보이는 액션과 연출  하물며 카메라 흔들어서라도 액션을 하는척 이라도 하는 연출조차 힘든가   리암니슨 그동안 무슨일이 있었던걸까   이건 뭐      액션배우 인생 그냥 한방에 훅 가버렸다고 인증찍는 영화인 듯  정말 너무나도 실망스러웠다 
블랙라이트,생략
블랙라이트,니슨옹
블랙라이트,액션이 형편없고 스토리도 쳐지는 느낌
블랙라이트,이 영화     년 는  리암 니슨 님의  테이큰 시리즈 에 이은 또다른 헐리우드 블록버스터 액션 영화인데요   리암 니슨 의 사실상 국적은 영국인데  왜 오로지 아메리칸 국적만으로 될    와 관련된 역할을 또 하려는지는 모르겠지만  그래도 그 배우가 한없이 실감나고 재미있는 액션연기하는데 아무런 지장이 없어야 할텐데  이 영화의 스토리흐름상태와 더불어서 뭔가가 설정이 안 맞고 이상한 부분이 있어서 정말로 아쉽네요  
블랙라이트,매력 넘치는 할아브 액션이 아니라  은퇴할 시기를 한참 넘긴 노인들의 갑갑하고 느릿느릿한 액션과 서사랄까  리암형님 넘 좋아하지만  별 고민 없이 찍어낼거면 그만 찍어요 
블랙라이트,효과적
블랙라이트,좋은영화네요 너무 잘 봤습니다
블랙라이트,   의 비리를 밝힌다는  뻔한 스토리와 지루한 전개 급작스런 마무리 잠깐의 액션이 있으나 그것마저 별로 아이스로드가 훨 나앗네요  킬링타임이라도 될까 했지만 너무 아쉬운 영화입니다  주인공을 좋아해 삼점 드립니다
블랙라이트,막상 보면 별 거 없는데   나오면 또 보게 되는 리암 니슨 표 아재 액션  딸바보  권총 한 자루  리암 니슨   이 세 가지만 있으면 무한대로 만들 수 있음 
블랙라이트,스토리가 너무 엉성해 후훗
블랙라이트,오로지 자신만을 위해 괴물이 되버린    국장과 이를 저지하기 위한 리암니슨의 절제된 액션이 어우러져 꽤 볼만한 영화가 됐습니다  국장을 보면서 이건 꼭 남의나라 일만은 아니라는 생각이 듭니다 
블랙라이트,뻔하다  액션도 힘을 못쓴다 
블랙라이트,특색 없는 액션과 이야기
블랙라이트,뭐가 좀 일이 생기겠구나 했는데 바로 해피엔딩으로 허무하게 끝남  그나마 귀여운 아가때문에 별  개임
블랙라이트,늘  비슷한 패턴의 식상한 전개와 액션은 흥미롭지 못한다
블랙라이트,기대가 너무 컸다    
블랙라이트,   
블랙라이트,오프닝에 중국 배급사 나올때 쎄했다  그때 껐어야 했는데   리암니슨 필모에 거대한 오점으로 남을 영화
블랙라이트,별로다
블랙라이트,테이큰을 기대하고 갔는데   스토리 망  연출 망  리암 니슨이 아까운 영화   최선을 다해 연기했을 배우들에게 행운이 가라고 럭키세븐 점수 줌  
블랙라이트,지루하고 지루한  급 영화 킬링타임 영화로 보기에도 애매하다
블랙라이트,결말이 너무 밋밋해  다른 사람에게 보라고 추천하지는 못할 것 같다 
블랙라이트,충격적 망작    할배는 이제 쉬시지 왜 자꾸 액션을     
블랙라이트,리암 니슨 나오는 영화 다 재미있습니다
블랙라이트,미국 코인텔프로를 현대화 한거라던데 흥미로웠듬  
블랙라이트,기대이상으로 재밌음  액션뿐 아니라 시나리오 자체도 튼튼함 
블랙라이트,니슨 할아버지 이제 그만     점점 재미없어지네   
블랙라이트,기대않고 봤는데 재미있어요  진짜 열일하는 리암니슨   
블랙라이트,리암니슨 나온다고해서 봤는데 근래 영화들중에 젤 잼게 봤습니다 
블랙라이트,기대 없이 봤는데 잼났어요  아빠도 예매 해드리고싶네요   
블랙라이트,리암니슨   배신하지 않네요  
블랙라이트,개인적으로 리암 니슨 영화 중에 젤 좋았던 듯 적당히 무거운 내용과 몰입도 높이는 액션까지 최고였다
블랙라이트,적당한 긴장감이 있고 몰입하게 되네요  재밌게 봤어요 
블랙라이트,아직도 맨몸액션 쌉가능한 리암 니슨 형님이 대단할뿐
블랙라이트,리암 니슨은 이제 하나의 장르가 된 것 같다  
블랙라이트,킬링타임용으로 무난했으나 결말에 이르러 모든 문제가 일시에 해결되는 해피엔딩은 좀 당황스럽다 
블랙라이트,난 재밌   봄   
블랙라이트,리암니슨 액션 언제나 사랑혀  
블랙라이트,킬링 타임용으로 볼만함
블랙라이트,어니스트씨프 아이스로드 마크맨     그리고 오늘 블랙라이트까지   혹시나 하는 기대감에  봤지만 역시나 실망 안겨주는 리암 니슨 형님
블랙라이트,리암 니슨 옹 그래도 맨몸 격투부터 카체이씽까지 다채롭게 액션 펼치신 거에 대해  정말 꾸준하신 거에 리스펙합니다  진짜 액션 외길 액션 레전드 다하십셔
블랙라이트,킬링타임무비로 즐기기에 딱 좋은 영화  
블랙라이트,역시 리암 니슨이다 전개도 좋았고 액션도 좋았다 리암 니슨이 잘 하는 걸 이번에도 제대로 해낸다
블랙라이트,최근 리암니슨 영화들 중 제일 재미있었음 내용이 쫀쫀해요
블랙라이트,킬링타임 용으로 재밌었어요 리암 니슨 오래오래 연기해주세요   
블랙라이트,액션영환데 액션씬이 너무 없다  악당도 매력없다   전개도 어거지다  
블랙라이트, 
블랙라이트, 
블랙라이트,이렇게 재미 없을 수가    그냥 리암이기에 한 시간 봤는데 도저히 못 보겠음
블랙라이트,아이고  많이 늙으셨네요   마음이 아프지만 그래도 평점은 객관적이어야 하기에  스토리 전개와 액션이 너무 어설퍼요  이제는 액션영화보다는 잔잔한 장르로 가셔서 감동을 주시는게 더 잘 어울리실거 같으네요 
블랙라이트,식상한 느낌   이번 액션  스토리가 그동안의 영화에 차별점을 부여해주길 바랄 뿐 입니다 
