title,review
드라이브 마이 카,나는 일본 영화랑 잘 안맞는것 같아
드라이브 마이 카,지루할수 있는 영화  보면서 졸리긴 했다만  참고 보다보면 괜찮아요 이건 근데 한국영화인지 일본영화인지 참   무라카미 책을 너무 좋아해서 잘 봤어요  단순히 킬링타임용 영화는 아님
드라이브 마이 카,무라카미 하루키 거품작가 원작 씰데없는 말장난과 뜬금없는 전개 싸구려  류영화
드라이브 마이 카,  
드라이브 마이 카,사별한 아내의 바람남과 함께 연극을 만들어야 하는 남자  인간에 대해 여러모로 생각하게 하는 영화  덕분에 끊었던 담배를 열열히 피우고 싶은 생각마져 들었다 
드라이브 마이 카, 
드라이브 마이 카,바냐가 매형에 대해 제대로 알지 못하고 자신의 방식으로 이해하듯 주인공도 부인을 제대로 보지 않고 자신의 방식으로 이해만 했음을 마지막에 깨닫고 미안함을 느끼는 것이 아닌가 생각했다    시간의 러닝타임은 희극의 내용을 관객에게 충실히 전달하고 희극에 연결된 주인공의 이야기와 희극을 연기하는 배우들의 모습이 세발자전거처럼 끌고 가기위한 시간이 아닌가 한다   아무리 가까운 사람이라고 하더라도 우린 타인을 자신이라는 안경을 통해서 바라보지 진정 알고 이해하는 것이 얼마나 힘든 일인가를 희극  줄거리  음악을 통해 알려준다  또한 중요한 것은 그럼에도 우리는 이리저리 엮여서 살아가야 한다는 것   다만 영화 전반의 건조한 전달방식은 체호프의 희극과 닮았지만 호불호가 갈릴것 같다 
드라이브 마이 카,너무 좋은 영화네요 
드라이브 마이 카,과거의 아픔에 얽매여 살것인가  받아들이고 앞으로 나아갈 것인가
드라이브 마이 카,늦게나마 상영관에서 봐서 너무 다행인 영화예요  상실감이나 소통 부재로 힘들었던 사람이라면 울림이 클 것 같습니다  감독님 연출 스타일 뚜렷해서 좋아요
드라이브 마이 카,나한테는 어려운 영화
드라이브 마이 카,내가 잘 못 읽는건가  어려운건가  어쨌든 지루했다 
드라이브 마이 카,너무 지루해서 끝까지 보는데 힘들었음   나랑은 안맞음
드라이브 마이 카,살아남은 자들이 죽은 자를 기억해야 하는 이유    그리고 삶을 견뎌내야 하는 방식에 대하여    
드라이브 마이 카,우선 어마어마하게 지루함  초반에 와이프 바람나면서 머가 벌어지나 했다가  와이프 별안간 죽어버림  죽고나서 머가 있겠지하고 봤더니   시간 내내 무미건조한 대화만   결말에 머가 있겠지하고 봤더니 웬걸   이거 두시간짜리로 만들었어도  지루하다는 사람 많았을 듯    내가 감정이 메마른건지  이해를 제대로 못한건지 모르겠지만 암튼 어마무씨하게 지루했음 
드라이브 마이 카,마지막 연극엔딩에서 눈물 찔끔   재미있게 봤고  연극대본을 링딩을 해보고 싶다는 마음이 들었다  감정없이 또박또박 천천히   
드라이브 마이 카, 
드라이브 마이 카,신기한 접근  소설인지 연극인지 단연 영화는 아니었을 세시간  왜 아카데미가 이 작품을 선택했는지가 궁금했을 뿐이었다 
드라이브 마이 카,인생은 참고 견뎌내는 것   감정에 솔직해질때 서로를 이해할수 있다   상대의 배신도 이해해내야 그나마 내인생을 버틸수 있다
드라이브 마이 카,형식은 존 카사베츠 차용 했지만 나름 신선  내용은 일본영화에서 많이 봤던 섹스 필터  슬픔  극뽁 졸라 지루 
드라이브 마이 카, 시간의 로우 템포의 진행방식     일본 특유의  상처받고 힘들어도 살아야한다는    일본 애니나 영화에서 보던    메너리즘에 빠진 감성주의 메세지    정말 상처받고 하면 그상처는 후회와 고통으로   남아 흉터가되고  잊으려해도 뇌리속 깊히 박힌다는  사실은  회피하고     다이조부     라는 믿도 끝도 없는 긍정메세지는  너무 식상함   
드라이브 마이 카,너무너무 지루함
드라이브 마이 카,인간의 심연이라는 그 칠흙 같은 늪에서 뻐져나오는 법은   시간과 우연과 타인인가보다  누구나 살아낼 수 있다  내가 가장 불행하고 비극적이라는 무한반복 테이프를 스토프 시킬수 있다면 
드라이브 마이 카,살아내자  우리 살아내자    그대로의 나의  삶  시간  세계를     이야기속에 빠져   시간의 러닝타임이 전혀 지루하지 않다  배우들의 안정적 연기  곧 거장이란  칭호를 얻게 될 하마구치  류스케 감독의 완벽   한 연출에 찬사를 보낸다   이런 작품을 만나게 된 큰 행운에 감사하며   
드라이브 마이 카,마지막 운전녀가  한국에서 한국부부가 키우던 개를 데리고 남주 차를 타는 장면은 뭔가요  한국말도 하던데    그녀가 다 죽였다는 의미인가 
드라이브 마이 카,별것도 없는 세시간짜리 운전에 지친다  그럴바에야 휴게소에 내려 맛난거 먹고 담배도 피고 무엇보다 시시껍절한 농담으로라도 좀 웃자 
드라이브 마이 카,체홉의  매력적인 대사들이  드디어  귀에  들어왔다 영화와는  다를것  같은  책을  읽어보고  싶다는  생각을  했다 우리는  마주보기  두려워  회피하며  살고  있다
드라이브 마이 카,이렇게까지 높게 평가될 거리인가 싶은 영화였다  주인공이 북해도에서 깨달음처럼 읊어대는 대사는 작위적이고 연극적이었다  결국 보여주는 주제의식마저 참으로 일본 드라마스러웠다  그게 왜 감동인가 싶은 그 주제말이다 
드라이브 마이 카,지루하고 재미도 없어요
드라이브 마이 카,물론 원작이 그러하겠지만 감정을 전혀 배제한 극한의 건조한 대사와 특유의 느리고 평이한 전개로 관객을 시험한다 연극의 대사가 각국의 언어로 전혀 통하지 않듯 이 영화의 관객과도 소통을 거절하는 느낌이다
드라이브 마이 카, 시간의 런닝타임과 다소 지루할정도의 느린전개    도대체 뭘말하고 싶은건지 알수없어 답답할때  큰 울림을 전한다    시간의 기다림이 아깝지않다   일본에서 이런 영화가 나오다니    살짝 배가아퍼온다   
드라이브 마이 카,재미없고 지루해 죽는줄 알았어요   
드라이브 마이 카,이 작품은  신세기 에반게리온  같은 느낌이 들었다 먼 소리지  이런 생각이 들면서도 먼가 전달하는 게 있는 건 확실한데 답을 잘 모르겠네   이런 물음으로 영화 의미 해석 전문 유튜브 리뷰 등을 찾아서 답을 알아야 하는   그런 영화 보는 사람에 따라서 극중극의 형식으로 받아들일 부분도 있고 화면에 담아내는 모든 것이 의미가 있는 방탈출 게임 같은 작품이다  이런 내용에 유머와 위트가 없다 그래서  시간은 너무 힘들다  심야에 감상하는 건 비추천   이 작품을 개기로 전작  아사코 를 찾아보는 건 비추천                  클래식한 디자인의 빨간 작은 세단이 이렇게  멋져보이다니   
드라이브 마이 카,소통과 화해를 하루키스타일로 잘 표현한 영화
드라이브 마이 카,생략
드라이브 마이 카,터질 듯 말 듯한 마음 속 응어리
드라이브 마이 카,연극적인 대사와 지루함을 견딜 수 있는자는 도전하자 
드라이브 마이 카,얼핏 비울 것 같더니 꽉 채워야 직성이 풀리는 감독인 듯   특히 무너진 고향집 잔해 앞에서의 긴 대화  과하고 상투적이고 졸렸다   다언어 연극 연습 장면들만큼은 감탄의 연속이었건만 
드라이브 마이 카,좋았습니다 
드라이브 마이 카,개인적으로 듄도 정말 재미있게 봤고 다큐나 독립영화도 좋아하는데 저한테는 너무 지루하고 어려웠습니다   같은 영화 두번 세번 보는 거 좋아하는 데 다시 보고 싶지는 않아요     이런 의견도 참고하실 분들이 있을 거 같아서 댓글 남겨요   
드라이브 마이 카,길지만 짧게 느껴지는 영화
드라이브 마이 카,정말 연기가 별로네요 
드라이브 마이 카,리뷰 영상들을 보며 영화를 더욱 깊게 곱씹어보게 됐다  나중에 한번 더 봐야겠다 
드라이브 마이 카,서로의 정신과 육체를 격렬하게 나누던 부부의 깊이는 진실과 별개였던가  배우자의 부정과 죽음이 극 전반부를 끝냈다면 다국적 팀원들의 각기다른 자국의 언어로 대본연습을 하는 영화 중반부 장면들이 체홉의 명대사들과 연속적으로 연결되어 개인적으로는 좋았다   결국은 죽음과 현재를 초월하고 승화시키려는 결말등  조금은 작위적인 대사와 연출등 작정하고 알려 주려는 영화로 끝낸듯해 그다지 진한 감동으로는 연결되지 않아 아쉽다 영화를 보면서 졸음도 오고 시간을 체크해보고 싶을 정도로 너무 길고 긴 런닝타임  아카데미상에 노미네이트된 이유가 뭔지   후보작이라는 기대감으로 극장까지 찾아가 보았건만 대형 스크린으로 볼 만큼의 영상미는 부족하고 넷플로 봐도 무방할 우리가 이미 보아왔던 일본영화 그 자체다 
드라이브 마이 카,시나리오가 재미와 감동이 있고 배우들 연기 또한  뛰어난  영화입니다  초반부 지극히 행복한 부부에게 어떤 사건이 생길까 궁금해하며 보았는데 여주가 죽어 아쉬웠는데 주인공은 그녀가 아니었어요  살아남은 자의 슬픔을 나름 조명한 의미있는 영화였습니다   상처입은 사람이 상처입은 사람과으로 같이 치유되다니 멋집니다 
드라이브 마이 카,비평가들이 좋아할 영화    시간 남짓 잔잔하게 진행되는 스토리를 몰입해서 보게 만드는 신비한 연출이 압권  화장실이 급해져도 억지로 참고 볼 정도 
드라이브 마이 카,러닝타임의 압박으로 인해 조금 지루했지만 한시도 눈을 뗼 수가 없었다 
드라이브 마이 카,그때는 몰랐었다는     인생은 살아 내야 한다는     이 어렵지도 않은 주제를 얘기하는데 런닝 타임을 두시간이면 될듯 한데    영화를  시간이라는 길이로 만들었다     너희들은 이렇게  예술   적으로  이미지를 보여주고 길게 설명 하지 않으면  주제를 읽어 낼수 없어          관객에대한 모독 이다   이렇게 만들어내는것도 감독의 재주 일듯 하다    길어도 너무 길다    이 영화가 칸느영화제 각본상 을 수상 했다는것도 놀랍다    도대체 깐느의 기준은 뭐임  
드라이브 마이 카,적어도  번 이상은 봐야할 영화
드라이브 마이 카,일본도 이런 영화를 만들어 낼 수 있구나   
드라이브 마이 카,오라이  
드라이브 마이 카,일본만이 만들어낼 수 있는 힐링 영화  체호프를 매개로 살아낼 길을 찾아가는 과정과 여운     길지만 지루하지 않은 영화인데  킬링타임용은 아니라는게 함정  연기      모두 좋다 
드라이브 마이 카,감독이 참 하고 싶은 얘기가 많구나 하는 느낌에 그러면서도 이상하리만치 집중하게 되는 되는 그런 영화입니다   그런데  우측통행인 한국에 제대로 자리잡은 빨간 사브    주인공의 자연스런 한국말 너무나 자연스런 주인공의 애견     엔딩을 잘 음미하여보면 엄청난 반전이      스포같아서 이만    
드라이브 마이 카,위로가되는영화 그냥 사는거임
드라이브 마이 카,하루키가 박수쳐줄듯
드라이브 마이 카,골든글로브 수상 축하합니다  궁금해서 와봤는데 하루키 작품의 영화화네요   영화를 아직 보지 않아 평균평점 주며 축하해봅니다 
드라이브 마이 카,일본에도 드디어 점점 더 훌륭한 영화가 나오는 구나하고 감탄하고 보다가 박유림 배우를 만나다 
드라이브 마이 카,외면과 기피는 회복과 재건을 포기하겠다는 어리석은 의지일 뿐  자리를 바꿔 앉아 긴긴 밤낮을 달리다 보면 느닷없는 위무의 존재를 만날 수도 있다 
드라이브 마이 카,살아 있는 사람들이 죽은 사람들을 기억한다  너의 쟐못이 아니니   지금의 너와 난 잘살아야한다  사실 우리는 언어가 달라도 서로 소통할 수 있다는 걸 잘알고 있다   보는 내내 니시지마 히데토시가 참 좋은 배우라는 생각이 든다 
드라이브 마이 카,소통에 관한 미학
드라이브 마이 카,일정 부분 일본 사회의 분위기를 반영하는 듯도 하다  문제를 직면하지 않고 비닐을 씌워 감추듯이 조용히 사람 숨막히게 하는   수십년간 한 집에 살며 모국어로 대화하는 사람과는 제대로 소통하지 않고  정작 처음 만났거나 언어가 통하지 않는 타인과는 소통하고 위로 받는 아이러니  체호프의 대사와 인생의 순간들이 씨줄 날줄처럼 엮여가고  내내 잔잔한 가운데  시간을 집중하게 만드는 연출이 일품이다 
드라이브 마이 카,설명적인데 
드라이브 마이 카,외국어 영화를 볼 때 대사가 길면 자막을 포기해야 한다  아니면 한 번 더 보거나   
드라이브 마이 카,나는 너란 언어를 알아간다  대화가 아닌 짧은 침묵의 긴 휴지     사이에서   
드라이브 마이 카, 
드라이브 마이 카,초반 시선잡기로 중반부터의 루즈함을 견딜 힘을 주었고 프롤로그격 이야기가   분넘게 지속되면서 주인공의 감정선을 이해시키기 위해 노력했다   이야기 자체에 안따까움이 있는데 어떻게 상처를 준 쪽보다 남겨진 자들이 살아 있기에 계속 고통받고 그럼에도 살아가기위해  스스로 찾지못한 당위성을 비슷한 고통을 받는 다른이에게 구하고 어떤이는 유사한답을 찾다 어긋나고 주인공은 정답에 가까운 결론을 고뇌 끝에 얻는 이야기 이다   우리는 완벽한 정답을 신이 아니기에 알수 없고 스스로를 이해시킬수  있는 각자의 답을  찾아야 세상을 살아갈 수 있다는 것을 느끼게 해주는 영화다 
드라이브 마이 카,삶이란 무엇인지 생각하게 만드는 영화 
드라이브 마이 카,최고의 영화
드라이브 마이 카,장장  시간  마사키가 자동차 속에서 이야기 하는 동안 졸았다  졸린 영화는 아니지만 상처입은 감정을 절제하는 인간들이 언젠가는 겪어야 하는  아마도 살아서 풀지 못하면 무덤 속에서라도 풀어내야할 법칙  영화 속에서도 제대로 풀지 못한 것 같다  사람들아 제발 통곡하라 그리고 반항하라 
드라이브 마이 카,무라카미 하루키에 이은 하마구치 류스케  젊은 거장의 등에 돋아난 원숙의 날개
드라이브 마이 카,한국배우가 많이 나온다   감독이 한국을 좋아하나보다  나카지마는 정말 잘생겼다   미리 원작을 읽고 영화를 보았다   원작에서는 결말이 없지만  영화는 결말을 만들었다   무라카미 소설 특유의 대화가  시간 내내 이어진다   무라카미 소설 좋아하면 꼭 보시길   그리고 무라카미는 섹스를 참 좋아한다 
드라이브 마이 카,글쎄요    이건 이 정도로 극찬을 받을 작품은 아니지 않나요 
드라이브 마이 카,인생은 살아내는것  
드라이브 마이 카,좋습니다   시간이   분처럼 짧게 느껴졌어요 
드라이브 마이 카,무라카미 하루키 정서 위에 건설한 하마구치 류스케 세계
드라이브 마이 카,국적의 다양성을 소설에서도 표현했는지 모르겠는데   시간동안 스무스하게 진행되는 과정이 마음에들는   그리고 주인공들의 내면 이야기가 이래저래 인상깊은 
드라이브 마이 카,공명이 가능한 아주 편안한 드라이브로   서로 상처를 털어놓고 위로하며 치유하는 힐링영화  
드라이브 마이 카,자동차 속에서 벌어지는 멋진 사랑의 결말     그 속을 향해서 가는 안타까운 길  
마이 뉴욕 다이어리,원작도 읽을만 합니다
마이 뉴욕 다이어리,   
마이 뉴욕 다이어리,큰 감동 없는 그냥 그저 맹숭맹숭한 영화  호텔 로비에서 모든 남녀가 함께 춤 추는 장면은 참 아름다운 명장면이다 
마이 뉴욕 다이어리,생략
마이 뉴욕 다이어리,간만에  영화가 끝나고 기분이 좋았어요 
마이 뉴욕 다이어리,한국의 메갈을 옹호까지 한 여자가 주인공인데 이런 스토리가 말이 되나  메갈 둘이 저지른 인천  살 여자아이 토막 살인사건도 옹호하려나 
마이 뉴욕 다이어리,목표를 찾는 길목에서의 많은 경험들
마이 뉴욕 다이어리,자아를 찾아가는 성장영화인데                  편곡은 물론 극 상황에 따라  흘러나오는  여러 악기음 감상하는 재미도 솔솔하다   
마이 뉴욕 다이어리,샐린저만 남는다
마이 뉴욕 다이어리,응답하라      뉴욕에 가고 싶다
마이 뉴욕 다이어리,주인공이 너무 사랑 스럽고    너무 너무 맑은 영화라 추천 합니다   시고니 위버 오랜만에 너무 반갑네요 
마이 뉴욕 다이어리,초반부가 너무 지루합니다 그리고 주인공이 너무 중 병같아서 아쉬움
마이 뉴욕 다이어리, 
마이 뉴욕 다이어리,진심으로  멋진 도시 뉴욕에서 벌어지는  즐거운 인생 이야기     진심으로 사랑해요  
마이 뉴욕 다이어리, 
마이 뉴욕 다이어리,출판업의 단면을 약간의 뉴욕 배경으로 그린
베네데타,권능인지 사기인지 모를 베네데타의 삶이 더없이 인간적으로 보인다  과학이 종교를 대치하는 시대에 믿음은 욕망과 질투를 타고 촛불처럼 흔들린다 
베네데타,지저스  오늘 죄를 지었사옵니다  야동서도 보기힘든 지저스 소중이 노출을 이 영화에서 당했습니다  통촉하고 죄를 사해 주소서  영화는 코메디와 비급을 오가더이다 
베네데타,감독의 명성때문에 보긴 봤는데 실화를 바탕으로 했다고는 하지만 뭘 말하려고 하는지 모르겠다 
베네데타,보고나니 어질어질하다
베네데타,만들어진 신 아래 만들어지지 않은 것이 무엇있으랴   가오가 전부를 지배하면 성인이 될 자격 하나를 얻는다 
베네데타,베네데타가 실존인물이구나 수도원이라는 지극히 폐세된 공간안에서 평생 살아가는 수도원들의 성이 얼마나 금기된것이렀을까 믿음의 강중은 있을지몰라도  믿음이 없다면 견디기힘들었겠지 지나치게 재미있진 않지만 뭐지모르게 몰입시키는 매력이있는 영화
베네데타,전기 영화로 봐야할까  지금도 판을 치는 사이비 종교 지도자의 행동들이 베네데타의 신념과 같은 범주라면     아   머리가 어지럽다  그리고 제대로 된 종교 지도자가 이 땅에 있기는 한 것인지    세상의 부조리는 과거나 현재나 변한건  없다는 생각이 든다 
베네데타,성령  헤게모니  욕정 이   한가득
베네데타,같은 이야기를 공포스럽거나 자극적으로 만드는 기술은 폴 버호벤감독의 장점이다
베네데타, 
베네데타,   
베네데타,생략
베네데타,감독 이름 때문에 원초적 본능 수준을 기대한분 있다면 실망할것임   중세 배경의 종교와 욕망을 소재로한 드라마   단순한 실화 묘사 이상의 갈등과 관계의 심연을 보여주려 노력한 영화  호불호가 있어서 재미있는분은 재밌겠고 취향 안맞으면 지루할거고   완성도로만 보면  점 줘야하는데 영화가 제 취향은 아니라서  점 깎음 
베네데타,  
베네데타, 
베네데타,광신의 틈에 욕망이 비집고 들어갔다 
베네데타,더러움을 묻혀가며 끝까지 보았다 
베네데타,성스러움을 갈구하는 성적 욕망
베네데타,결말씬 대환장파티 충격과 통쾌함을 느낌 
베네데타,독특했다
베네데타,폴 감독이 영화 시작후  분간  내용과 주제를 일목요연 요약함  이후는 그   분간을 위한 서사임   그 아이는 어렸음에도 깜찍한 믿음의 확신으로 도적떼를 기적을 외쳐 물리쳤고  도적은 놀라 꽁무니를 감추는데 사실 그 기적은 우연히 떨어진 새똥에 불과했으니    중세의 무지  종교의 세속화  공포의 페스트  억눌린 여성의 인권 상황에서 구원의 힘 혹은 그 상징으로 베네데타가 수용되고 몰락하며  이후 긴 속죄가 진행되는 과정으로 읽힘  아직도 연출의 힘이 대단한 폴 노익장의 최근작이라 반기면서  좀은 아끼면서 잘 감상했음
베네데타,종교적 금기를 어쩜 이리도 적나라하게 표현한단 말인가    
베네데타,성녀인 척하는 광녀의 기막힌 스토리 실화여서 더욱 놀람 
베네데타,엘르 볼 때와 비슷한 감상으로 관람 중 무슨 감정을 느껴야할지 가늠이 안갔다  형식적인면에서 비슷한 악령들      만큼에서의 광기는 아니었지만 보다 더 심도 있고 더 깊이 여러 측면을 탐구한 것 같다 
베네데타,괜찮음  그녀의 남은 삶이 어땠을까 계속 생각나게 하는  영화  추천할만 함 
베네데타, 
베네데타,   
베네데타,  
베네데타,명작 
베네데타,환영을 품은 믿음  금기를 떨치는 욕망  그 경계를 넘나들며 관습을 허무는 존재  뜨겁고 따갑다 
베네데타,또 한 번 금기와 통념에 도전한                       만큼 세련되지 못한 게 문제 
베네데타,실화 바탕인건 엔딩크레딧 올라가면서 알게된 일반인 관점에서 평하자면       나름 금기된 사랑을 관객에게 전달하며 무엇을  표현하고 싶었는지 영화 끝날때까지  도돌이표처럼 되뇌이게 한다    에로틱 관점에서 몇몇 신을 제외하곤 영화가 실화기반이라 너무 심심하며 이를 보완하기 위해 메시아 관련된 신을 넣은게 뜬금포라고 해야하나     최근 본 영화중에서 적잖히 실망스러운 영화였다    
베네데타,성과 속 이중적 존재성의 극치  
베네데타,수녀원장과 처녀와의 레즈비언 영화
베네데타,너무 잼나게바써요  여주인공 연기짱 매력짱짱   
베네데타,중세 시대  성혼의 불길한 징조를 나타나는 두 여인의 금지된 사랑   그 사랑은 영원히 지속 될지 
베네데타,폴 버호벤 아직도 건재함을 보여주면서   중세시대의 또다른 인간적  원초적 본능 과 탐욕을 그린다 
티탄,인류애가 느껴진다
티탄,난 페미이면서 여성우월주위자고      대 이고 좌파 진보주의자이며   병환자이다 이영화 인생영화다
티탄,프랑스 영화는 가끔 봄       
티탄,밑도 끝도 없다
티탄,참신함을 가장한 기이함   그리고 예측가능한 결말  
티탄, 
티탄,약 빨았다 정말  연기  연출  메시지 모두 굉장하다  인간과 메탈의 조화라는 공각기동대형 주제인데  정말 살아있는 것처럼 만들었다  너무 잘 만들어서 기괴하고 섬칫한 것은 덤  보는 내내 힘들었지만 오랫동안 기억에 남을 듯 
티탄,뭐지
티탄,영상은 기괴한데 메세지는 확실히 전달하네 잘못된 스테레오타입 정보를 진실인줄로 알았고 그렇게 살면서 만족했던 나는 각성이 필요한듯
티탄,도대체 개연성은 어디다 팔아먹었는지   뇌가 금속이라서 인간의 사고방식으로는 이해할수 없다는건지 뭔지  이따위 영화를 자꾸 만들어내는 이유는 뭘 좀 아는척 찬양하는 영화 평론가들 때문이라고 봄   김기덕 냄새가 난다는 사람들 있던데  김기덕 감독은 개연성은 있었고 좋은 작품들 많이 만들었다고 생각됨
티탄,내 몸이 아파오는 거 같은 마법 같은 영상 영화 보는 내내 인상을 찌푸리고  주인공의 몸부림을 볼 때마다  내 몸에 타격이 오는 거 같은 느낌이 들었다 여성의 나체를 주구장창 보는 데 이리도 불편하고 기괴한 느낌을 주는 멘탈 털리는 경험을 했다   아무도 이런 미친 영상을 실사화 할 생각을 안 해서 일단 만들었으니 상을 챙겨주나       일단 주연 배우들의 미친 연기력은 인정할 수밖에 없었다
티탄,심리적 묘사 보다 상징만 난무하는 난해하고 괴기한 영화 초반 집중도는 좋긴 했음    잔인하다고 하는데 감정이입이 안되니 그냥 그랬음   
티탄,이런 쓰레기를 만들어놓고 상을 받아요  예술 참 쉽네
티탄,기괴하고 괴랄하지만 신선하긴 하네
