title,review
"그 여름, 가장 차가웠던",    비율이라니   신선했고 자허가 가진 상황에 가슴이 아품   
"그 여름, 가장 차가웠던",날 잡아줄 사람이 아무도 없다는 자허의 현실에 한번 숨이 막히고 기가막힌 색감과 연출에 또 한번 숨이 막힌다
"그 여름, 가장 차가웠던",다소 스토리와 상반되는 스타일리쉬한 색감에  한번  독특한 화면비에 또 한번 빠졌다    감독 당신은   
"그 여름, 가장 차가웠던",진심으로 차가운 물 속에서 먼지가 된 한 소녀의 슬픈 인생 이야기  
미드나이트,이 작품만든 감독 기억했다가  다시는 보지말자
미드나이트,   
미드나이트,정말 이건 아니다      다음 영화 점수 처음 남기는데   감독님 다신 영화 만들지 마세여   개연성이란 단어 존재하지가 않음
미드나이트,고구마    가 아니라      개네 아    짜증나  배우들 연기가 아깝다 특히 진기주 연기는  
미드나이트,이 정도면 진기주  위하준이 불쌍하다    등장하는 모든 이가  심지어 엑스트라까지 다 똥멍청이가  되는 매직    주변에서 칼부림이 나도 경찰도  군인도 못 알아채고  다 범인 편     구경하는 시민들이 빙 둘러 서있는데 경찰은 아랑곳 않고 그 사이에서 실탄 마구 발사    뭐하자는 거여 지금     이거 코미디 영화였던거야 
미드나이트,답답해서 울화통 터지는 영화는 첨본다  극한까지 내모는
미드나이트,배우들 연기 너무 좋으네요  
미드나이트,별 하나도 아깝다
미드나이트,상식이  없는 영화    
미드나이트, 
미드나이트,장애인은 다바보 경찰은 똥멍청이 이게 주제  
미드나이트,엉망
미드나이트,장애인 비하 영화  몸에 장애가 있는데 머리까지 장애로 만듦  영화보는 내내 고구마  억개 먹은 느낌  이걸 평점  점 이상준다고 
미드나이트,    채널에서 봤는데 시작부터 몰입감이 생김과  동시에 갑갑함과 답답함이 몰려 와서 보는내내 갑갑하게 봤음  진기주 배우의 연기력만 돋보이는 영화라고 할 수 있고 내용이 현실과 너무 말도 안되게 전개되어 물없이 고구마 먹으며 보는듯한 느낌 이었음
미드나이트,여러분   정말 잼있어요   많은분들이 꼭 보시길 바랍니다    반드시 반드시 보셔야되요                                       
미드나이트,재빨리 경찰에 신고하지 않거나 경찰이 시민의 이야기에 귀를 귀울이지 않거나 방범카메라로 보고 시민들이 귀가 들리지 않을수도 있다고  충분히 파악이 될것임에도 불구하고 짜증을 낸다거나  등의 여러정황들이 많이 답답하긴 했지만 청각장애인들의 실정을 좀 이해하는 계기가 되었습니다   배우들 열연이 좋았고 고생 많았습니다  박훈 배우의 역할이 좀 더 강한 캐릭터였음 하는 아쉬움이 있습니다 
미드나이트,경찰은 왜 있는걸까  차 소리도 들을 수 없는 청각장애인은 위험이 사방에 있다   
미드나이트,청각장애인이 위기에 얼마나 취약한지  집과 거리에 경보장치가 있어도  파출소와 경찰이 있어도  장애인에게 어떻게 장벽이 될 수 있는지   각 상황을 치밀하게 구성해서 보여준 수작이다  범인이 고비고비마다 벗어나는 것 때문에 답답하다고 느끼는 관객의 저평가가 많지만  지능이 뛰어난 싸이코 범죄자를 상정한다면 각 상황마다 제작자의 설정은 충분히 교묘하고 세심하다  진기주의 장애 연기도 위하준의 광기 어린 연기도 좋았다  아주 재미도 있고  장애인의 고통을 호소하는  메시지도 의의가 커서 가슴 아린 작품이다 
미드나이트,세상답답한 영화처음보네
미드나이트,보다 짜증나   나옴  역시 사람은 다 비슷한듯        여기서 위로 받음  
미드나이트,현실성      쓰레기 영화라고 보면됨  파출소에서는   치고바고 부수고 싸우고있어도 경찰들은   밖에서  절대 안들어오고       만 확인해도 상황은 끝날것도 절대 확인안하고    피흘리며 여자가 도망쳐도 전혀  도와줄 생각안하고  마지막으로   여자 칼로찌르고   버티고 있는 범인 근처도  못가고   실탄으로  쏜다      말되니 
미드나이트,     삼류도 못되는  사류영화    엄마역  경찰역  군인역  오빠역등 무슨 연기들을 그 따위로 못하냐     진행도 엉망    설정도 엉망   
미드나이트,경찰들 바보 쓰레기들 만들고      군인들 바보 쓰레기들  만들고     보다 암걸려서 뒤질뻔    
미드나이트,이거슨 영화가 아닙니다 그냥 쓰레기입니다    로  보다가 화가나서 아무 죄없는 애들한테 짜증을 냈어요
미드나이트,저는  장애를 갖고 있는 친구들을  한번 더  살펴 볼 수 있는 계기가 될 영화인 것 같습니다  무조건 경찰을  부르는 것이 상책인듯요  배우님들 관계자분들 고생하셨습니다 
미드나이트,고구마    개 먹은 만큼 답답하고 화나게하는영화다   경찰
미드나이트,지금   에 나와서 보고 있는데  아무리 밤이라지만 범행 장소 주변에나 아파트에나 사람새끼 한명도 없고 경찰도 바로 출동 안하고  꼭 지금의 하는일 없이 놀고 먹는 경찰들 보는거 같아서 공감은 되지만     만 밖에 안들은 이유를 알겠네요 
미드나이트,견찰은 국민이 어려울땐 옆에  없다
미드나이트,아주 재밌게 잘봤습니다
미드나이트,고구마  만개 먹은거 같은 영화
미드나이트,평점                    점 
미드나이트, 
미드나이트,괜찮네  진기주라는 배우 
미드나이트, 점 
미드나이트,    
미드나이트,이건 뭐 인내심의 한계를  테스트 하자는건지   왠만하면 영화 끝까지  보는데 이건 중간에 꺼버렸다 
미드나이트,잘보았습니다 해피앤딩 감사합니다
미드나이트,이딴걸 영화라고 만든 사람은  제정신일까 
미드나이트,감독아  평점 안보냐    평점보고 반성이라는 것좀 해라   아님 영화를 만들지 말든가  
미드나이트,아 시바 욕나오는 영화    에서 하길래 보다가 채널 돌리고 열받아셔 일부러 댓글 쓰러왓네요 스토리  전개에 완전 말도 인되는 농아자들 엿 미기는 영화  진짜 욕냐오는  
미드나이트,경찰들이  살인마하나  안잡고 이놈이범인이라해도 안잡고 엉뚱한사람이 범인이다하고 답답한 전개 스토리청각장애인들 사운드때문에 재미는있으나   군인들 답답하다 범인이바로 눈앞에있는데 진짜   장애인 말못한다고 안들린다고   끌고와서  범인한테  대려다주는게 어딧어  어이없음  너무 억지스런연기  경찰들이역할은대체 뭐니   답답할따름이다      가하나도안보이는  살인마죽일수있는 상황 많은데  살인마로인해서  청각장애인역할이  다르게보이네요 집  불빛하고 움직이는 차안  소리음향이 저렇게쓰이는걸알았음  나름볼만했음  나름 스릴있는거같고다른사람들은별로라하시는데  전 재미잏게 잘봖어요
미드나이트,킬링타임으로 좋다    볼만하다
미드나이트, 점도 아깝다 답답함을 넘어 깝깝해서 허패 디비지는 영화 머 긴박감을 그런식으로 만들어 질거라 생각한 모지란 감독의 창조물
미드나이트,무능한 경찰이라 그렇다치고 역대급 어설픈 연쇄살인마  완전 개콘이네 진기주 다음에 조은 영화 에서 만나보길 역대급 쓰레기 연기 연쇄살인마
미드나이트,   
미드나이트,연기보다 연출이 얼마나 중요한지 이 영화를 보니 알겠다 
미드나이트,왜    에 전화를 안하냐   현실성있게 영화를 만들어야지
미드나이트,청각장애인아닌 농인입장에서는 가짜 농인배우이라면 수어와 농사회모르고 꽝의 꽝이랍니다 또한 수어도 엉터리 완전 엉망입니다 심란하네요     수어의 언어 파괴와 같으니 앞으로 하지 마세요
미드나이트, 점도 아깝다  개노답
미드나이트,제작사 감독은 뇌가 없나  왜 이따위 영화로 배우들을 괴롭히냐 배우도 편들수 없는게 시나리오 보면 몰라서 이런 영화에 출현해서 본인의 흑약사를 만드나
미드나이트,배우들은 뭔 죄냐   
미드나이트,감독이란 놈은  분명  붕어의 지능을 가진 놈이다    이게 영화냐     
미드나이트,와  역대급영화다 이렇게 속터지는 영화  처음본다 감독은  무슨생각으로 연출했는지 시각장애인을  위한영화냐 
미드나이트,스토리가 개판이고 억지스럽네
미드나이트,   들의 콜라보 대환장 파티 답답해서 죽고 싶으면 이 영화를 보세요 
미드나이트,어떻게 이런 수준 낮은 영화를 만들려고  생각했을까   배우들 연기도 한심하고  아무나 연기자가 되는 요즈음 대세
미드나이트,아시아영화 관객상 은상 미드나이트        이게 더 신기하군  뜻은 좋으나 영화는 아쉬움 투성이 스토리 완전 어색 경찰에 신고는 왜 안하는지   그만큼 경찰이 신뢰가 없다  해병대도 바보 특전사도 바보  만드는 영화  세상사람들이 이기적인걸 보여주는듯 하나 너무 과해서 짜증남
미드나이트,보는 내내 대환장하는 영화 영화 끝날때쯤 속이 후련해짐 길거리에서 남자가 내동생 내누나 내엄마  라면서 시부려도 일단 경찰 부르고 사실관계 따져야될듯 이게 왜 평점 낮은지 이해못
미드나이트,배우들 연기는 너무 좋았는데 하필   
미드나이트,열 받게 하는 발암   영화 보지 마세요
미드나이트,연기자들만 고생했네 초반까진 스릴있더만 그담부턴 그냥 작가랑 감독이 말아먹었네
미드나이트,티비로 보는데 역시나 고구마         개
미드나이트,참 영화 짜증나게 답답하게 만들어놨네 
미드나이트,주인공도 바보 엄마도 바보  오빠도 바보 경찰도 바보 군인도 바보 지나가는 사람들도 바보  바보들 세상
미드나이트,진짜 쓰레기 영화다  감독이나   극본이나   더해 투자자나   한심하다        이 먹여 살리는구나   
미드나이트,서울 사람들을과 경찰을 집단 머저리 쓰레기로 만들어 놨다 벙어리가 칼들고 설치는데 아무도 신고를 안한다  헐     알바는 무슨 알바야     속지 말라는 니가 알바구만 아니면 육성인지 하는  쓰레기 감독이던지    
미드나이트,   같은 클리셰  역시  너무 뻔하다
미드나이트,깬다 
미드나이트,자막을안너은이유가머냐    이딴쓰레기영화만들면서
미드나이트,평점      방금    에서 봤는데 보는 사람이 화가 나고 벙어리 모녀가 죽었으면 하고 바라게 되는 영화    도망자 슈퍼마켓여자주인 케릭터들이 우글우글 출연하는 영화    한국 영화 쓰레기연출의 결정체   
미드나이트,진기주님 연기너무 잘해요  
미드나이트,싸구려 영화입니다   완전 
미드나이트,이건 개그도 아니고 코미디도 아니고 도대체 뭐지  완전 저급  이걸 스릴러물이라고 만들까 청각장애자를 주연으로 하려면 좀더 탄탄해야지 이게 뭐냐 우스운 영화 낮은평점이 아깝 다 폎점 주는것도 아깝다  개그코메디네   뭐하러 만들었을꼬
미드나이트,진기주는 이쁘고 군인세명은 얼차려좀 받아야한다  청각장애인 입장을 잠시나마 체험하면서 답답함보다는 공포감이 들었다  영화는 엉망이지만 평점을 낮게줄순없어 
미드나이트,이게 영화냐    고구마 백만개는 먹는 느낌
미드나이트,진기주 밖에 볼게 없네  진기주가 멱살잡고 가는 영화네  감독님도 군인들 나오는 장면 깨는거 아시죠  사람이 저렇게 쫓기면 누구라도 한 사람 정도는 신고해줄텐데  시민들을 무뇌아들로 만들어놨어  경찰은 말할것도 없고 
미드나이트,벙어리  연기에 속터제 죽겠는데  스토리까지 이거보다가  사람들 암 걸릴 듯
미드나이트,와  진기주 어찌 배우 된거냐   수상해    다이어트 시급한분들 고구마 드셔야 할분들 꼭 보세요 강추 합니다 고구마   만개 먹은 느낌
미드나이트,현실반영 잘된것으로 보이는데  최근 인천경찰 도망간사건 보면 경찰에 대해서 잘 알고있네
미드나이트,억지유발 영화  고구마가 먹고 싶을 때 보세요  속 터져 죽음 
미드나이트,학교 영화과 연습작 같은 수준 주연 빼고 좋은 조연 배우들이 아깝군요 연출 각본 모두 망작
미드나이트,내가 공감능력이 없는것인지 감독이 공감하기 어려운 상황을 억지로 만든것인지 고구마 천만개다 컥컥
미드나이트,아무리 새벽이라지만 서울 동네에 개미 한마리 안돌아다니는 설정은 뭐냐  
미드나이트,아주 여자들은 머리 안돌아가고 상황파악 못하는    취급하고 엿멋일려고 만든 영화  감독이 여자한테 억한심정 있나 
미드나이트,답답해서 숨막혀 죽고 싶으면 이 영화 보세요
미드나이트,숨막히는 스릴러란 이런것  진짜 답답해 숨막혀야 
미드나이트,재밌게 봤습니다    진기주씨한테 호감이 있어서 보게됐는데 청각장애인 역을 정말이지 깜짝 놀랄만큼 잘하시더군요 보는 내내 스릴있었고 우리 두 딸들한테 꼭 보라고 해야겠어요  위급한 상황일수록 정신 똑바로 차리자고   
미드나이트,오씨엔에서 해줘서 봤는데 평점은 구리긴 하나 평점에 비해서는 나름 배우들 연기도 좋고 재미는 있음  근데 너무 말도안되는 설정이나 답답함은 평점을 깎아먹는 주요요인 경찰서 장면에서는 진심 답답해서 티비 끌뻔    좀 적당히 그렇게 했으면 나름 수작이었을듯한데 현실과 괴리감 드는 장면이 많긴하네  그래도 평점보고 망작  급영화인줄 알고 반신반의 하고 봤는데  킬링타임용으론 나쁘지 않게 재밌게는 본듯
미드나이트,정말 스릴있고 의미있는 영화였다  현실이 쉽게 왜곡되어 전달될수있음을 보여주었다
미드나이트,이세상이  고구마라는걸 각인 시켜주는 영화다
미드나이트,이걸 영화라고 보고있었네요    
미드나이트,쓰레기 영화 보는 동안  미치는줄  야 뭐 세상이  이렇다고  감독  뭔데
미드나이트,쓰레기 같은 영화   말도 안되는 시나리오    이걸 영화라고 만들어 놓다니      별 반개도 아까움 
미드나이트,말하기도 싫고 별 더 작은거 없나 
미드나이트,감독이 뉘기여 
미드나이트,이걸 돈 들여서 만들었냐  도대체 누가 글을 쓰고 누가 연출을 했니  이 대본을 보고 출연하겠다고 한 배우는 그냥 뭐든 출연만 시켜주면 아무거나 다하나봐 들인 돈이 얼만지는 모르지만 아깝다 
미드나이트,역겹네
미드나이트,연기만 좋았다 
미드나이트,진기주님 포함 배우분들  연기 와    사실 초반 잘 가다가 경찰서에서   이거 뭐지   뭐  항상 영화에선 경찰이 나와서 정리하면 좀 그러니까    그래도 쫌 하다가  마지막에 진기주님 상황 정리 부분 반전    전 잘 보았습니다  우리 나라 영화도 많이 좋아졌네요  
미드나이트, 점을 입력할수 없다는게 억울하다  감독이 발암물질  보시다 암걸리시고 싶은 분께 적극 추천드립니다
미드나이트,평점  도 아까운 개망작
미드나이트,한심할 정도로 바보같은 영화  
미드나이트,별점 주기도  민망한 수준의 연출  소재나 연기는 괜찮았는데 그나마도 압도적인 폭망 연출이 깎아먹었네요  요즘같은 한국영화 중흥기에 얼음물 한바가지 제대로 
미드나이트,경찰이 저렇게 멍청하진않지 시사성을 주려했지만 청각장애인이 저렇게 소리를  지를수있단  말도 안되는  편견이 더  장애인을 우습게 만드네 시민들은 다 소시오패쓰   
미드나이트,평점 조정용 늙으면 해피엔딩 좋아요
미드나이트,전부 바보들인가  진짜 고구마    개먹은거 같이 답답하다 아무리 영화라지만 현실과 너무 동떨어진다 좋은 배우들로 이렇게 영화를 개판으로 만들수 있는지
미드나이트,그냥저냥  모자란 지구대 근무자들을 보는 듯 한 답답함 
미드나이트,본래 이런 류의 영화는 욕하면서 보는 맛이 있긴 하지    금붕어 머리도 아니고 방금전 까지 살인마한테 쫓겨 죽을뻔 사람들이 자기집에서 아무일 없듯 일상생활로 돌아가는게 외상후 스트레스는 개나 줘버리는 듯한   스탠리 큐브릭의 샤이닝 명장면 연출   
미드나이트,평점을 미리 봤음 지금 안봤을텐데 소품이고 뭐고 큰돈 안들여서 찍은영화티가 팍팍 남  좋은배우들은 다 모아다놓고 한씬 끝날때마다 컷 하며 박수쳤을 엉터리감독생각에 웃음부터 나오는 영화  청각장애인 모독영화라 생각함 
미드나이트,쉬지도 않고 단숨에 이 영화를 본 사람들한테 경의를 표하고 쉽다 
미드나이트,영화 내내 범죄에 노출된 청각장애인의 무기력함을 보는 것이 답답하지만 줄거리 자체는 쫄깃하고 이쁜 여주의 반전도 좋았다
미드나이트,나만 당할순 없다   
미드나이트,정말 심각함             이 배우들이랑 이렇게 만들기도 어려울듯
미드나이트,개인적으로 너무 재밋엇음  현실성이 조금 부족하지만 시간 날때 보기는 좋은듯
미드나이트,경찰서에 집기 부수고 난리를 쳐도      도 안보는 경찰들 그리고 중요한 순간에 둘이서 밖에서 담배피고 있고 경찰서 에 한명도 없이 비워둘수 있나 감독 새끼야 아무리 내용을 어거지로 만들려해도 좀 상식을 갖고 해라 이야기를 끼워 맞추느라 고생한다  
미드나이트,영화보고 첨 댓글 담    에서      스트레스 풀려고보다 스트레스받으며   본 최초의영화 꾹 참으며 딴짓하면서  욱하면서 끝까지 보고 답답해 잠도않오네요   
미드나이트,정말할일없어서봤다 감독이눈군지   다른직장알아보는게좋을듯
미드나이트,혼자 죽을수 없다  보고 같이 죽자 
미드나이트,역대급 고구마 영화
미드나이트,정말 쓰레기 영회  감독은 참   
미드나이트,극장에서 안보길 잘했지   로 보는데 짜증나서 못보것다 이것도 영화라고   등급이다
미드나이트,영화 스토리가 너무 답답하고 논리적이지 않아 짜증이 났음   너무 산파처림 질질 끌어
미드나이트,정말 정말 답답해서 보다 죽을듯
미드나이트,평점이  너무 높다   요즘세상에 이런영화가 나오다니       
미드나이트,지금 오시엔에서 하는데 파출소 장면 보자마자 바로 욕하고 채널 돌림       열만 받음 고구마     개
미드나이트,별 반개도  아까움 비현실적  억지스러운 전개로  작가나 감독이  관객을 너무 호구로 본듯합니다  보는 내내 짜증이나서  일부러 검색해서  평점 남겨보기는 처음이네요  이런거 걍  만들지  마세요
미드나이트,딱 한국이네 망작   
미드나이트,오랜만에 좋은  영화 봤내요
미드나이트,진짜 너무 열받아요 재미도 없고 고구마    개 먹은 기분 진짜 이정도 밖에 못만드나  무슨 경찰이랑 청각 장애인을 호구로 만드는 영화네 이런 영화를 보고 있는 나까지 호구로 보고 만든 영화인가 싶네요 진짜 최악임  보다가 껐음 짜증나서
미드나이트,각본까지 감독이  정말 감독이 열연한 배우들과 아까운 시간에 고구마 쑤셔넣은 관객들 한테 석고대죄 해야 할 망작  무슨 말을 하고 싶은지는 어거지 과장 설정으로 표현하지 않아도 알겠는데 전하고자 하는 메세지 조차도 남일에 관심 없는  중국에서나 공감을 살만한 내용이고 주인공이 청각장애인이라는 설정 때문에 답답한게 아니라 현실성 없는 전개와 보는사람 환장하게 만드는 연출이 보는 내내 영화속 악역을 욕하는게 아니라 감독을 욕하면서 보게 만드네요 
미드나이트,열받다 슬프다 잼나게 봤어요  수고하셨습니다
미드나이트,최고의 코미디영화 추천추천 마지막까지 빵터졌습니다
미드나이트,고구마 먹은 것 처럼 엄청 답답한 전개인데  딱 하나 마음에 드는게 마지막 장면   
미드나이트,멀쩡한 여성들도 손쉽게 당할수있는 흉악 범죄를 듣지도 못하는 청각장애인이 타켓이 된다면 범인이 다가오는 것도 모르니 얼마나 위험하고 끔찍할까 라는 소재는 아주 좋았지만 진짜 개연성이 너무 형편없고 개판이다 
미드나이트,시나리오 참   동네 장난꾸러기들이 만든 이야긴가  검찰이 만든건가  경찰이 금치샨잔데   
미드나이트,어디까지 인내를 하라는건지     보고있는데 답답함을 넘어서 참을 수없는 짜증이 밀려와서 꺼버렸네요   정도껐해야지 개연성 없는 스토리   진짜
미드나이트,한국경찰이야 원래 그모양이라 기대도안하지만  이 영화보고 청각장애인에 대한 인식이 더 좋아지네요 지들이 손가락질만 하면 남이 어떻게 알아들으라는건지  보니까 핸드폰 타수는 엄청빠르던데 경찰에서 범인이랑 오빠랑 싸울때도 밖에 경찰들에게 범인이라고 얘기해주지도 않고  범인이 집에 침입했을때 방문 잠구고 핸드폰 들고 있어도 신고도 안하고    이건 장애 이전에 지능의 문제로 보이긴 하지만  장애인 피해자를 이렇게 똥멍청이로 그린 감독의 문제겠죠
미드나이트,보는내내 답답해 죽는줄 고구마    개는 먹은느낌   
미드나이트,쓰레기영화임
미드나이트,오랜만에 위하준씨 박훈님 진기주씨 나와서 재미 있게 잘봤습니다 
미드나이트,진짜 쓰레기영화 시간이 아깝다 감독님  반성하세욧
미드나이트,이걸 영화라고 만든건가요 
미드나이트,내가 보기엔 수작 같은데 이사회에서 장애인에 대한 배려가 얼마나 없으면 일부러 답답하게  저런식으로 꼬집어 만든거 같은데 보는 시각마다  서로 다르니 원
미드나이트,개연성 밥 말아먹은 쓰레기 각본  연기자들 연기는 좋은데 말도 안되는 상황들 연속  감독이 쓰레기 
미드나이트,소재는 참 좋았고  여주 집에서 전등 깜빡이는 걸로 분위기 조성하는 것만 좋았음  연쇄살인마가 사람을 죽이질 않아   모두 다 해피엔딩 만들어 줄려다 보니 상황이 납득이 안가고  살인자를 미워하고 피해자를 응원해야 하는데   이건 뭐 딱히   
미드나이트,와 진짜 이거만든 감독은 뇌가 장식인가 이따구로 만들고 돈받아물라했나
미드나이트,이런 쓰레기 영화 첨본다     보는내내 성질나서 영화를 감독혼자 상상해서 만들고  똥꾸먹으로 만들어도 이보다 더 잘만들겠다    내가 보기엔 감독이 정신병자네   
미드나이트,발암 영화 이런거 감독하는 사람은 그냥 상상속에서 사는 사람인듯   
미드나이트,클레멘타인 이후 수작
미드나이트,장애인은   이고 경찰은 더   이고 범죄자 응원하게 만드는 영화 이런것도 영화라고
미드나이트,혹평하는 분들     신고나 파출소나 경찰서 한 번도 안 가본 분들이시죠  의왜로 신고하고 출동하고 금방 안옵니다  당사자들은  분이   분 한 시간 같거든요  파출소 칼들고 난동부리고 도심 한복판에서 칼들고 난동 부려도 출동하고 제압하고 얼마나 걸릴꺼 같은데요  억울한일로 경찰서나 파출소 한 번도 안 가본 방구석 여포들이 개연성 어쩌고 이러니 참으로 답답합니다   제가 본 올 국내 영화 중 최고의 영화였습니다  감독 배우들 스탭들 고생하셨습니다 감사합니다 
미드나이트,이것도영화라고   진기주 꼴에 배우라고  본인 옛날에 인기많았다고 하는데    하  연기도별루  외모도 너무너무평범해요   도대체멀믿고  연예인이됏는지
미드나이트,진짜 영화 못만든다 경찰서 씬 부터 망했다
미드나이트,경찰서 씬에서 감독 패주고 싶었다   개연성이라곤  도 없는 쓰레기 영화 
미드나이트,생략
미드나이트,진기주 인생작 박훈 자리잡는 영화가 되었으면 추격자 이후 최고의 영화
미드나이트,너무 역화가 억지스럽다  쫒기면서    시고는 왜 못하냐  경찰들은 허수아비에   분이면 떡칠 내용을  시간으로 늘려놓아 억지억지억지스러 진행이 실망이다  하지만 주인공 여자 연기는 좋았음 대성할 배우같음
