title,review
문폴,중국자본 들어간 영화는 자본만 유입되는게아니라  꼭 연기 못하는 끼워팔기식 배우와 중국의 기술력이 영화내에 삽입된다   어떻게해서둔지 중국이 짱이고 중국이 최고라는 약한 개가 짖는소리가 항상 삽입이되고 그렇게 안하고는 못견디는 간장종지만한 옹졸한 중국인마인드가 담뿍 녹아있다  앞으로 중국자본으로 영화를 만들어야한다면 자본은 투입하되 중국은 지워버려라 그래야 산다    세기에   세기마인드 중국영화따윈 보기싫다
문폴,유랑지구 헐리우드 판으로 그저 그런 영화  개연성은 역시 밥 말아 드셔서 핍진성이 늑히 낮다 
문폴,돈을 이리 쏟아 부었지만  황당함도 정도가 있다는 원칙을 넘어 설 순 없었다  잠깐 잠깐 나오는 중국 여자가 백인을 구해주는 모습에서는 이질감 때문에 혀를 찰 수 밖에 없었다
문폴,댓글러들의 평가는 냉정하다 그들의 식견은   옳다 
문폴,롤랜드 에머리히가 중국 자본을 만났을 때   어디까지 막 나가나 두고보는 맛이 있음 
문폴,보면서 중국 냄새가 풀풀 나더니 그런가 
문폴,너무 재밌었어요  가정한 내용들이 너무 흥미로웠고 긴박한 연출이 너무 맘에 들었습니다  여러 고난 속에서도 이겨내는 모든것이 맘에 드는 영화였고 많이 위로 받았어요   정말 추천합니다 
문폴,역시 중국산 영화        
문폴,어쩌려고 이 쓰레기 만화를 끝까지 보았나     무엇을 해야 이 화가 풀리나   
문폴,저는 중국자본이고 뭐고간에 아무것도 모른상태로 봤는데요  헐리웃 영화가 이렇게도 졸작이였나 싶었는데 역시 중국자본이 투입되었나보군요  연출은 그럭저럭 평타는 했지만 스토리와 구성이 너무나도 질이 낮더군요    년대 재난영화 처럼 너무도 어설프고 시대에 뒤떨어집니다  특히 느닷없는 안경뚱뚱한 배우는 영화가 끝나도 왜 있었어야 했는지 도무지 이해가 안됩니다  너무 화가나는 장면들이 많았고 필요없는 장면또한 너무도 많았습니다  재발 이런류의 영화는 그만 만들었으면 합니다  인터스텔라나 그래비티 같은 영화의   분의  도 못따라간 졸작 이라 생각 됩니다 
문폴, 점영화는 절대아니지만 평점보정용으로    점대가 적당한 영화  
문폴,소재가 참신해서 보면서도 저 중국배우가 극중 있어야할 이유가 머지 의아햇는데     아무리 영화라지만 말도안되는 스토리 진행이고 또 왤케 이야기를 푸는방법도 되게 구닥다리네요 헌옷들을 짜깁기해서 옷만들어입은 느낌입니다
문폴,이걸 영화라고  만들었냐    달속에 들어갈때부터 쎄하더라
문폴,어이없고 재미없는 억지 영화
문폴,     재앙
문폴,짱깨가 묻는 순간  이미 영화가 아닌 개허접 쓰레기가 된다는 진실의 재확인 
문폴,엣날 선조는 중국인의 마인드를 가지고 있었다   그래서   가 인류멸망이 우주에 평화를 가져올수 있다고 자각한 것이었음    반대하면 중국인 
문폴,뻔한 스토리 가족의 사랑 확인  용감하게 희생하는 주연 또는 조연  지구 구원 로 구성된 영화이다  그냥 거르는 것이 더 나을 듯 싶다 
문폴,쓰레기 영화
문폴,보는내내 지루했음   
문폴,총체적 난국  어떤면에서는   라고 봐야하는 영화에서  말도 안되는 헛소리와 음모론을 들고 옴  몰입감과 개연성이 거의 희미한 인물들의 돌발적인 행동과 갑작스러운 신파극의 나열  도대체 이게 무슨 상관인가 싶은 이야기들의 조각난 반복 배치로 떨어질 수 밖에 없는 집중력 중국자본의 불쾌함을 보여주는 모범적인 케이스인  갑작스런 중국어와  쓸 데 없는 중국언급에 요즘 중국입김들어간 헐리우드 영화에서 반드시 나오는 아무것도 하지 않는 중국여자  명
문폴,    의 그 스펙타클함은 어디가고      예산이 딸렸나    거기에 예측이 되는 너무 전형적인 스토리  복사 붙여 넣기 스토리     
문폴,예고편만으로 만족을 하는건데          차라리 애니메이션으로 만들면 나을뻔한 산으로간 스토리    
문폴,공감이   도 되지않는 영화
문폴,왜 우주산업에 더이상 돈을 투자 안할까요  세상은 돈이 넘쳐나서 이딴 쓰레기를 만들고 있는데 돈없다고 못한다는게 이해가 안되서요   
문폴,장점  에머리히 감독답게 다 때려부심            할리베리와 중국배우 이쁨            하우스만 박사 맘에듦  단점  중국자본과 왜놈 협찬의 콜라보           너무 터무니없는 내용을 영화로 만들어낸 감독의            용기                처럼 나가다가 인디펜던스데이로   
문폴,영화를 선택한 배우들이 불쌍
문폴,개연성부족  비과학적   초반 좀 지루하지만 킬링타임용으로도 초반 지루    
문폴,창의적인 상상력 이긴 하나 너무 뻔함 늘상 봐온 블록버스터 재난 영화
문폴,생략
문폴,거참 다 살고 가족위해 헌신한 새아빠 톰만 죽었네    아무리 시나리오 쓸게 없다고 유투브 떠도는 음모론으로   대작 만들 돈을 날리냐      
문폴,한마디로  괴랄한 영화
문폴,헐리웃 감독과  배우가 출연한 중국 쓰레기 영화  벌레 나오는 쓰레기 같은 영화임 
문폴,맨날 똑같은 패턴   드라마가 휩쓰는 이유
문폴,훠어이  짱깨   왜구 콜라보 
문폴,                       그 래     문의  몰락   문재앙의  몰락이다                           
문폴,짱깨 요소가 흐름 끊긴해도 솔직히 재밌긴함 눈호강도 적당하고        오락영화에서 예술을 바라는 무지성 힙찔이들 평가 너무 박하네      
문폴,투머로우와     는 몇번 봐도 재미있게 볼수 있지만 이건 한번 보든 것도 힘들다 망작
문폴,  이하 관람용 
문폴,지금 보려고 하는데 중국 자본이 묻은 거엿군요    재미 없겟네       
문폴,중국 만물기원설을 입증하는 엄청난 영화   세상은 샤오미로부터 시작된다 
문폴,     뭐지 왜 삭제 된거야     다시 써줄께  이 영화는 롤랜드 커리어에 최악의 망작이 분명하고 할리도 커리어에 다시한번 큰 데미지를 입게 될것이다   렉서스 광고비에 중국놈들 자본으로 만들어진 영화가 오죽하겠냐    라고 생각했는데  상상을 뛰어넘는 망작의 탄생이구나 
문폴,뻥이 심해도 너무 심하네요  아무리   라지만 너무 와닿지 않는 내용이에요  달에 토끼가 산다고하면 모를까 
문폴,중국영화를 안 보겠다고 맘먹고 있었더니 이런식으로 떼넘들 영화를 보게 되네
문폴,      투모로우를 기대했건만 일본침몰이 나왔네   
문폴,짜장 냄새가 심해서 안본다    
문폴,일단 돈 많이 들여서    개는 준다 혹시나 했는데  시간이 아깝다
문폴,중반쯤에 눈치챘어야했는데  중국어 하는 여자애  한자 문신이야기  중국서 우주선  빌린다 했을때     차이나머니 들어간 영화  후반부는 그냥 중국식    물    신파     아 낚였네 할때 영화는 끝이남     중국영화인데 할리웃 배우넣어서 속인영화   이왕 하는김에 주석 사진도 넣지  그랬어    달도 중국이 만들었다고 우길려고 만든영화  믿고 거르세요
문폴,   
문폴,글 쓰려고 로그인 했다   달이 인공구조물이다    음  이건 뭔 자다가 봉창 두드리는 소리냐  아놔  짜증나네  
문폴,  
문폴,짱깨  렉서스 때문에 짜증나긴 해도 에머리히 감독의 스케일과 참신한 내용 때문에 볼 만하긴 함 
문폴,일단   씨지는 대박이고 좀 스토리  황당허무   결론적으로     에이아이가   쿠데타 일으켜서    인간멸종시킬려고 하는것       가 낫다고 본다     그냥 소소하다    
문폴,끝까지 보고 말았던 내가 한심하네  
문폴,저작비가 아깝다
문폴,지구도 움직이는데 달도 구해야지    있을 법한 상상력이지만 딱 그기까지만 보여주고 감독의    범벅도 부실한 스토리를 전혀 채워주지 못한   
문폴,재미있고만     이 정도면  잘 만든거지   
문폴,감독의 전작들에 비하면 많이 실망스러움 하지만 짱깨 묻은걸 감안하면 그나마 괜찮은 편임
문폴,승리호가 참 대작이란걸 다시한번 느꼈다
스펜서,비극을 바탕으로 사이코드라마를 만들었네  다이애나비는 죽어서도 별 시덥잖은 것들한테 이용당하는구나   
스펜서,영화가 전체젃 으로 어두운건  그녀의 삶이 그만큼 외롭고 황페했기때문  동화속 공주처럼 세기의 결혼식을 올렸던 그녀가 망가진 이유가 곡 남편의 불륜이었을까 자의식과 자존감에 상상못할 상처를 받았던게 아닐까 남편의 사랑을 못받는다해서 이처럼 불행하게 생을 마감하지 않을텐데   가여운 신데렐라
스펜서,닮은 모습에 봤는데 과장된 제스춰 남발로 피곤 모든 부분에서 과함
스펜서,영화내내 암울한 음악과 보는사람도 신경쇠약 걸릴거  같은영화 조금은  이해가 가지만 너무너무 지루하다 다이아나비를 좋아해서 꾹 참고봤음  
스펜서,기대를 많이 했는지  답답해서 보다 말았습니다
스펜서,재미도 없고  감동도 없고   지루함만 있을 뿐  연기도 왠지 어색하기만 하고   숨막히는 분위기 조성은 잘한 듯  음악이 괜찮았다 
스펜서,어느정도 예상은 했었지만  생각보다 영화가 훨씬 더 우울하네요  왕실에서의 그 답답한 시스템을 실감나게 느낄 수 있었음  하루에 옷을 도대체 몇 번을 갈아입고  그것도 정해진 순서에 따라서    옷 갈아입고  밥 먹으면 하루 다가겠네요  그리고 설마 했는데  진짜 그레고리가 앤 뷸린 책을 다이애나 방에 갖다 둔거네요  참나    저 당시 다이애나 심정은 아무도 이해 못할것임  전 세계가 주목하고 사랑하던 왕세자비가 남편에게 버림받고  왕실에서는 인기많은 다이애나를 더 싫어해서 딱 봐도 왕따시키고 어디서든지 자기들끼리 뒷다마 깠겠죠  예전에 퀸이라는 영화를 봤을때도 엘리자베스  세 여왕이나 왕실 사람들이 얼마나 다이애나를 못마땅하게 여겼었는지 다 느껴졌음   저 위압적인 곳에서 그걸 혼자 어케 견디나
스펜서,연기 매우 좋음 하지만 불안한  정신상태와 히스테릭한 태도  숨막히는 분위기가 네버엔딩으로 이어져 중도포기함
스펜서,시작되는 에피소드 부터 다이애나 눈빛이 무슨 부적응 정신병자로 그려내고 있음  여주 캐릭터 해석 오류인듯
스펜서,독일에서 서울오는   루프트한자 비행기안에서 자막없이 봤는데  뭔내용인지  다 느껴지더라  못먹고길바닥에서 구걸하는 장애인도 있는데 너무 배불러서 나약하기만 했던  다이애나
스펜서,영화를  보는 내내  왜이리도 갑갑한지   그냥 영화를 보는  나도 숨이 막힐 거  같던데 다이아나는 오죽했을까 라는 생각이든다  
스펜서,정말 재미없다
스펜서,크리스틴 스튜어트의 연기가  다이애나가 빙의되듯 이미지가 비슷했다  다이애나의  내면연기가  좋았으나   앞부분이 없이   내면애기만  있다보니  관객이 추측해야하는부분이 아쉬웠다
스펜서, 
스펜서,시작부터 끝까지 우울함과 불쾌한 감정들이 뒤죽박죽 느껴지는 아주 슬픈 영화 영국 날씨와 꼭 닮은 우중충한 왕실의 틀 속에서 여왕은 행복할까 
스펜서,그 누구든 그 사람의 인생을 살아보지 않고는 그 사람을 평가할 수 없다  인간으로서 자유롭게 행복한 생활을 원했던 인물이 상황의 감옥에서 얼마나 불행했는지 보여준 영화라고 생각한다 
스펜서,미국배우가 영국왕실 왕세자비를 연기한게 놀라운 따름이나  여성 버디영화인지 헤갈린다  영국왕실의 가족이 되려면 오랜 관습의 무게와 파파라치의 관심을 피하기 위한 그 정도의 희생  더구나 윌리엄 해리 두 아들의 어머니로서 책무를 지는 것도 도저히 견디기 힘든 일이였을까  결국은 이혼후 아랍 부호와 연애 중 파파라치를 피해서  도망가다 파리에서 교통사고로 삶을 마감했는데 두 아들도 버리고  바람 피긴했지만 왕실 의무에 대해 설득하던 남편도 버리고 자유를 찾아나선 여정의 안타까운 결말이 평범한 삶을 사는 시민들의 먹고사는 생활고보다 더 심각했다고 할 수 있나  미성숙한 인격  왕관 무게를 감내할 수 없는 성품으로 자신에게 맞지 않는 옷을 입고 괴로워했던 한 여자의 홀로서기라고 생각하고 싶지만 전혀 공감하기 힘들다
스펜서,고구마 열개 한꺼번에 먹은 느낌의 영화     
스펜서,다이애나의 고독과 절망에 대한 영화  자신의 옷 한벌  악세사리 하나 조차도 본인의 취향을 내세울 수 없고 두 아이의 양육방식이나 교육에 대해서도 목소리를 낼 수 없고  바람피고 냉정하기까지 한 찰스  다이애나가 인간적으로 불쌍하기 그지없었다 
스펜서,진작 벗어나야 했을 곳
스펜서,만인의 사랑을 받았으나 님의 사랑만이 필요했던 프린세스 다이애나  왕실이 주는 구속과 억압속에서 어떻게든 숨쉴 구멍을 찾고자  때맞춰 세팅해 놓은 드레스를  실수인척 바꿔입고  먹은 음식을 토해내고  여왕보다 행사에 늦게 도착함으로써  불륜하는 남편과 외면하는 왕실의 불편부당함을 어필해보고자 했는지도     왕실의 일원이기 보다 자유의지를 실현시키는 존엄한 인간이 되고자 했던 다이애나는 이름을 묻는 패스트푸드 직원에게  스펜서라고 답한다   엄마는 뭐 때문에 슬프냐고 묻는 윌리엄의 질문에 다이애나 대신 내마음이 무너져내리는 영화  스펜서 였습니다
스펜서,여주 심리상태가 블랙홀이라 나까지 빠져드는줄 
스펜서,스산한 음악만큼이나 불안한 정신 상태를 보여주는 영화 재미보다는 다이아나비의 심리 상태를 보여주는 영화 크리스틴의 연기가 너무 좋았다
스펜서,나에게 허락되지 않은 자유  나를 사랑하지 않는 남자  나의 삶을 얽매는 관습  보는 이마저 신경쇠약에 걸릴 것 같은 그녀의 삶 
스펜서,정확히   무슨 얘기를할려는 건지   그냥 추측해야할 뿐이네요        그녀의 삶이  우울했다는건가    근데 비싼  고급음식들을 먹는건데  왜  소화못하고 토한  이유는 좀 이해안가고    오히려 패스트푸드는 잘먹고      음       뭐가뭔진     
스펜서,왕실의 답답한 굴레서 벗어날려고하는 가련한 다이애나  
스펜서,  
스펜서,크리스틴의 연기는 정말 완벽했다  근데 엄청 재밌거나 흥분되지 않는다
스펜서,총에 맞아 죽거나 차에 치어 죽을 수밖에 없는 운명을 타고난 왕실별장의 꿩   다이애나가 스펜서로서 지금까지 살아있다면 좋았겠다 잘은 모르지만 좋았던 느낌의 다이애나 크리스틴 스튜어트가 그냥 다이애나였다 
스펜서,볼만하다
스펜서,생략
스펜서,   
스펜서,연기 내용 암것도 없고 영상미만 있음  대실망 비추
스펜서,보고 있는데 정신병 걸릴 것  같아요  깜이 안되는  왕세자비
스펜서,화질이 안좋아요 의도적인듯 첼로 선율이 내내 슬퍼요 아름답고 슬픔 전반적으로 지루함
스펜서,다이애나 왕세자비로 빙의했던 크리스틴 스튜어트
스펜서,크리스마스  일간 다이애나비의 심리를 그린 영화     주문 에서 이름이 뭐냐고 묻자 스펜서  라고 했을때 왕가에서 두 아들과 자신이 탈출하다시피 자유를 만끽하는 씬이 가슴이 저민다 
스펜서,봤어요  휴    지루해서 혼났심        한 개인의 넋두리 보다는 당시의 사회 군상과 왕실과 그들이 교섭하는 집단의 행태  또는      년대 옛날 분위기도 좀 곁들여지지 않을까 했건만   예상 불발  이번엔 영화 선택에 실패 
스펜서,그녀를 옭아메는 모든 것들이 의상으로 잘  표현되어 있음 
스펜서,내가 다이애나가 되어 영화를 봤어요    아들이 엄마에게  무엇 때문에 슬픈지 물을 때   나에게 묻는 것 같아 그때부터 내가 다이애나가 되었고 내내 마음이 아팠어요
스펜서,겉보기는 화려하고 명예로워보이지만  전통과 관습을 수호하기 위해 진정한 자신의 모습을 감추고 연기하며 살아야하는 영국 왕실의 삶을 다이애나를 통해 느끼게 해준다  크리스틴의 연기가 무척 훌륭함  역시 평범하게 사는 것이 최고여 
스펜서,우울해져요    힐링하실 분들은 패스 
스펜서,병맛국가의 불필요왕족에서 고생한 멘탈약한 약해진   여인이야기  크리스틴의 연기는 좀 에바던데  아래 시간 개아깝다는 의견  킹정 
스펜서,완전 재미있어요 꼭보세요
스펜서,왕  세자비  가    전하     목걸이를  먹는지 
스펜서,시간 개 아까움 예술병 걸린 사람들의 영화 이런거 내놓고 자기들끼리 시상하는게 웃김
스펜서,숨통을 조이는 그곳의 공기와 영혼을 갉아먹는 그들의 전통  고통을 토해내는 다이애나의 모습에 가없는 연민을 느꼈다   크리스틴 스튜어트  우와  
스펜서,일부 환상 장면이 포함되어 공식 이혼전 그녀의 스산함  불안  초조  분노  토막난 모성애가 매초 단위로 전개된다  인간적으로 못견딜 상황    자유로운 젊은 여인이 감금당한 규율  이용당한 결혼  빈껍데기의 남편으로부터 달아나려는 본성  관성  저항의 격하고도 미묘한 저항이 추운빛  애매한 화사함 속에 죽음을 향해 돌진한다  나름 출중한 연기들  절제된 연출 등 수작임
스펜서,음악  스토리  연기 탄탄한 영화  강추
스펜서,결국 사고로 죽은 여자잔아  그런 여자가 아무리 틀에박힌 굴레를 벗겨낸다 해도 결국 자살비슷한 마지막을 보낸   이겨내지 못한 여자를 뭘 그릴 난리로 영화를 만드냐 꼴두 보기 싫다   이겨낸 여자를 보여라 영화로
스펜서,다이애나 스펜서    그곳에선 행복하기를   
스펜서,재미보다는 분위기를 느끼며 보는 영화  크리스틴의 오스카는 유력할 듯 
스펜서,왕실 전통 무게감에 피폐해지는 자아  이에 벗어나려는 한 여인의 모습을 담았다 
스펜서,연출 연기 완벽한 영화였어요  보고나면 먹먹하고 화납니다
스펜서,열려있지만 닫힌 경계를 넘어 내 이름을 찾는 비행
스펜서,크리스틴 스튜어트 용안이  경건하네요  절경이고요
스펜서,나름 취지는 있겠지만  어찌  시간 내내 불안  징징거림  자학만으로 채워 관객에게 심리적 고문을 하는 영화를 만들었을까  각본가나 감독 누구든 소시오패스 기질이있는 것 같다 
스펜서,크리스틴 스튜어트 아카데미 수상하겠네요
스펜서, 
스펜서,크리스틴 스튜어트의 완벽한 연기
스펜서,크리스틴 스튜어트 너무 이쁨
스펜서,왕실에 적응못한         애미가 이러니 둘째 해리도 오늘날 이모양 이꼴이지 
스펜서,살아서는 세기의 아이콘 죽어서는 퀸 프린세스  오브 하트    
스펜서, 
스펜서, 
스펜서,개봉날만 기다리고 있어요  
스펜서,다이애나 왕세자 비의 안타까운 생애를 그린 작품   진심으로 기대됩니다 
스펜서,빨리 개봉해 주세요  플리이즈 
스펜서,너무 기대됩니다 
모비우스,킬링타임용으로 생각보다 볼만함   평점 점은 될듯   조절용으로   점줌 
모비우스,뻔한 스토리  재미도 극적 용소도 없다  평범한 흡혈귀 피를 마셔야되는 흡혈인간 이야기가 지극 단순하게전개
모비우스,나름 볼만한데 평점이 너무 낮아서 만점 줌
모비우스,평점보고  안볼까하다가 봤는데  진차 재밌게 봤어요
모비우스,진빼이 배트맨이네   
모비우스,자기는 막 죽이면서 친구는 못죽이게 하는건가 
모비우스,영상과 액션은 좋은데 스토리가   그래서 혈액에 대한 갈증은 대책이 나온 건가요  마일로 죽이고 자신도 같이 죽으려고 항체를  병 만들었던 거 아니었던가      
모비우스,소니도 참 한결같다 
모비우스,아    진짜 이렇게 재미없게 만들기도 쉽지 않았겠어 
모비우스,전형적인 스토리
모비우스,호불호가 갈리겠으나 나름 흡혈박쥐 와 인간의 유전자 조합  병을 치료하는 게 원래 목적 이였던 부분이 안쓰러웠다  그러나 전체적으로 마블에서   풍이 느껴진다고 해야할까  어벤져스만 보다가 색달라서 좋았다 
모비우스,플롯이 진짜 어떻게 생각했던거와 단  도 안틀리고 그대로 따라가냐    도 괜찮은거 같다가도 또 어떨때보면 이상하고    예전이었으면 그래도 주목받는 캐릭터였을텐데  요새는 히어로던지 안티히어로던지 캐릭터들이 하도 많이 생겨나서 그냥 그런 캐릭터로 남을 듯   
모비우스,시간때우기 나쁘진 않은데 뭔가 뻔한스토리라  
모비우스,  
모비우스,간만에 재밌게 보았습니다  시간 아깝지 않게요  
모비우스,이게 뭐람
모비우스,재미있게 봤습니다  짐캐리의 마스크가 떠오르는 얼굴만 빼면     
모비우스,넷플에  뜨길래 무심코 봤는데 나름 재밌었음  주인공이 멋있음 같은상황에도 주인공들은 선을따름  
모비우스,재미가 없어도 너무 없네요  스토리도 액션도   도 볼 게 없어요  악당이 악당 짓하는 이유도 너무 어이없음  심심해 미칠 것 같아도 절대 보지 마세요 
모비우스,재밌어요   흡입력 좋네요  
모비우스,평이 왜이렇죠  전  재밌게 봤는데
모비우스,재밌어요  
모비우스,모비우스    베놈 
모비우스,  
모비우스,쓰래기
모비우스,볼만한데      들이네     여기가 칸느냐
모비우스,안타깝네       러닝타임    분 보다 앤딩 크리딧     분 남짓한 영상이 훨     씬 흥미롭네
모비우스,즐겁게 잘 감상했다  흡력초인이라니  초감각과 비행능력은 좋은데 피를 마셔야 한다는 것이 너무 취약점이네  그리고 기본적으로 선한데 벌쳐와 팀업을 어케 하려고 쿠키를 저렇게 만들었나 싶네  나중에 또 다른 작품에서 본다면 반가울 듯  런닝타임이 짧아 신속한 전개가 미덕인데  빌런과의 싸움이 너무 허접하다  그외는 볼만함 
모비우스,어쩌다 능력자 악인등장 사연있는 악인인듯 아닌듯한 주변인물   가족이나연인위협 결투 질리도록 보아온 마블의 뻔한 전개가 반복된다  단지 매력없는 캐릭터만 새로 나왔을 뿐  드라큘라나 뱀파이어  심지어 배트맨까지 있는와중에 마블이 선택한 최악의 악수는 모비우스라는 박쥐인간이었다  공감도 재미도 의미도 없는 무미건조의 끝판  디즈니의 쓸데없는 간섭에 가족도 마니아도 잃어버린 마블의 현주소 
모비우스,차기작에 캐릭터 하나 더 추가하려고 날로 만든 영화
모비우스,예측 가능한 단순한 스토리와 스테레오 타입의 캐릭터   총체적 허술한 전개로 모비우스는 한없이 가벼운 영화로 기억될 듯 그래도 액션 장면은 화려해서 보기 좋았다  먼저 개봉한 두 편의 베놈보다는 재밌게 관람했다 
모비우스,최근 마블 히어로 영화가 갈곳을 잃은 무색무취임을 여실히 들어낸 영화가 아닌가 하다   이런 졸작이 이어지는 이유가 무었지는 모르겠으나 그냥  급 액션정도만 기대하면 될듯하다 
모비우스,쓰레기 같은 영화 이런건 돈주고 보면 아까움 하지만 통신사로 무료로 봐서 돈은 아꼈는데 영화 보러 간 시간과 기대감등을 생각하면 실망감이 컸음 전혀 정보 없이 그냥 마블 히어로 장르라서 기존 마블 기대하고 봤는데   나와도 보면 안될영화 스파이더맨 시리즈와 베놈 모비우스 알아보니 죄다 소니 픽쳐스 컬롬비아 픽쳐스  만든 영화임 스파이더맨 최신 시리즈는 그나마 스파이더맨  명 나오고 해서 볼만했지만 베놈     모비우스 스파이더맨 이전 작품들 다 마블 캐릭터 판권을 사서 소니가 만들어서 마블급으로 생각하고 볼 영화들이 아님 이건 그냥 마블과 다른 영화라고 생각해야함 마블 로고만 빌려서 만든 후진 영화 임 앞으로 베놈 모비우스등 마블 판권주고 산 소니 픽쳐스 제작들은 죄다 걸러야 함   
