title,review
루카,너무 좋았다
루카,픽사가 갈수록 이상해지네       
루카,디테일이 장난아닌 힐링되는영화
루카,브루노  알베르토  줄리아   베스파 타고 친테 퀘레를 붕 하고 싶다   픽사 애니메이션         개봉  
루카,이탈리아와 지중해의 향기가 잘 뭍어나는 가족 애니메이션이다  디즈니와 픽사가 내세운 미야자키 하야오의 감성  이탈리아 영화의 낭만    의 요소를 더한 새로운 도전이란 점엔 심하게 무리가 있어 보인다  미야자키 하야오 작품의 감성은 그 세계관을 봐서는 차라리  인사이드 아웃 이나  소울 같은 작품이 더 가깝게 느껴진다  이탈리아의 자연 풍경과 억지   를 넣었다고 그 감성이 닮았다고 하기엔 무리가 있어 보인다  픽사의 작품이라기엔 다소 동떨어진 스타일이지만  자연과 낭만을 배경으로 한 판타지 가족 영화라는 점에선 역시나 디즈니 답다는 생각이 든다  기대했던 스타일의 작품은 아니지만  개인적으로 이탈리아를 좋아하는 사람으로써  힐링되는 기분만큼은 충분히 느껴지는 것 같다 
루카,오랜만에 디즈니 다운 작품  
루카,코코 이후의 픽사의 행보가 너무 걱정된다     이렇게 가볍고 얼렁뚱땅 스토리가 넘어가진 않았었는데   
루카, 
루카,어린이의 호기심과 자립심 강화 그 사이에 있는 만화영화     잼나게 봤습니다  
루카,애니중  단연 최고네욤
루카,이 영화는 정말 재밌고  루카와 알베르토의 우정을 잘 볼 수 있었던 영화입니다 
루카,스토리가 재밌고 풍경이 예쁘다
루카,처음볼뗀 엄청 재미있어서 내일 또봐야지 했는데 또보니깐 별로 재미는 없었다   그래도 내용은 좋았다
루카,공존에서 탈주로
루카, 
루카,와  울면서 봤다 
루카,재밌다 재밌다
루카,루카와 알베르토  그리고 줄리아  자아의 발견  성장드라마    
루카,찐이네요  바다와 낭만 베스파  자유 우정 감동   미쳤네요 영화는 역시 이태리여  감독님이 정말 뼈를 깎아넣으셨어요 꼭 보세요
루카,땅위에 올라오면 인간으로 변하는 두 바다괴물 소년  루카 와  알베르토   그리고 인간 어부의 딸인 소녀  줄리아 간의 우정과 의리  바다괴물과 인간들의 가족간의 사랑이 따뜻하게 스며들어오고 감동을 준다  바다괴물과 인간들이 서로를 받아들이는 모습은 종족  인종간의 갈등과 차별을 겪고있는 인간세상에 대한 바램과 메시지   알베르토 가  루카 에게 부정적인 생각  브루노 가 나설 때 마다          나서지마   라고 외치라고 가르켜 주는 건 관객들이 인생에서 고난을 헤쳐나가는 데 있어 용기를 주는 팁이 될 수도 있겠다  어린이들도 좋아하겠지만 어른들이 봐도 재미있고  훈훈한 마음으로 가볍게 나올 수 있는 좋은 영화 
루카,아무 기대없이 봤다가 너무 재미있게 봤습니다  개인적으로 그동안 픽사 작품들에 실망 많았었는데  이번 작은 진짜 잘 만든 듯    이태리인들의 특유한 엑센트와 몸짓  감탄사들 진짜 잘 살렸네요  이태리인들과 일도 많이 했었고  지금 사는 곳도 이태리애 한 명 같이 사는데  진짜 똑같음     스토리가 뻔한 듯 하지만  재미와 감동 다 잘 살렸습니다  마지막에는 진짜 울컥했네요  그리고 어린 시절에는 저런 우정도 있었는데  나이 드니깐 삶에 찌들어져 이제 저런 우정은 아련한 추억으로만 남았네요  많은 걸 생각나게 하는 애니였습니다 
루카,요즘 픽사가   쩝
루카,평점이 낮네
루카, 
루카,아이들한테 거짓말을 하게 만드는 것은 좋은게 아닌데    
루카,이게 재미없다고  닥쳐 브루노 
루카,스토리가 산으로  
루카,그래  무지에 의한 혐오가 우리의 행복을 절대 막을 수 없어   역시  픽사  
루카,소울 보고도 그랬는데   다시 보고 싶어지는 영화
루카,겨울왕국처럼 스펙터클하고 거대한 스케일을 가진 영화는 아니지만  아기자기하고 귀엽고  바다와 마을을 오가며 그려지는 풍광이 아름답고 시원해보입니다  어른들에게는 뭉클함을 느끼게 해줘요  아무래도 뽀로로떼고  살부터 재밌게 볼 것 같아요 
루카,내용도 재밌고 진짜 영화 힐링    영상미 최고
루카,첫 발자국
루카,생략
루카,꿀잼  퀼 좋고 스토리 좋고 음악 좋고 캐릭성도 좋아요 
루카,얼마 전에 본 굴뚝마을 푸펠과 너무 수준 차이가     역시 값하는 픽사   이탈리아의 어촌마을 배경이 여름과 너무 잘  어울리고 좋았음   끝부분이 너무 급하게 마무리 된 게 아닌가 하는  아쉬움이 있지만   그래도 감동은 크다  살짝 눈물이     끝나고 바로 일어나지 말고   엔딩 크레딧까지 봐야함 
루카,영화의 소재와 캐릭터가 의외로 참신하다
루카,아 마지막에  감동에 벅차 울었네  루카 알베르토의 우정 너무 이쁘다 애들  
루카,디즈니  의 간섭이 느껴짐   픽사의 장인정신이 없어짐   이제 픽사의 정신은 역사속에 사라짐 
루카,너무 뻔하고  지루하다 
루카,귀엽고 사랑스런 애니입니다  너무 재밌습니다   
루카,영상과 줄거리가 좋아서 시간 가는줄 모르고 봤음  보는 내내 내가 여행갔던 이탈리아 친퀘테레 생각이나서 더욱 좋았다  
루카,어린이에게 꿈 희망 용기같은거를 갖으라는 그저그런 만화영화 
루카,   
루카,그래 조금 특별한 친구들의 여름 이야기       루카는 해피         세이프 오브 워터가 생각나는 영화          
루카,스토리가 설득력이 없다
루카,            
루카,시나리오   점 영상미   점 캐릭터디자인   점  어류디자인 진짜 별로  
루카,일단 캐릭터가 사람이 아닐때 호감적이지 않고    시나리오도 이번엔 그닥   
루카,영상이 좋았음  내용도   
루카,픽사는  사람을 울게 만든다니깐 
루카,코코 이후로 오랜만에 인생영화 갱신 역시 갓픽사라는 말 밖에    
루카,란마    아니 루카  역시 믿고 보는 픽사
루카,가족들과 너무 재미있게 봤어요   아이들도  도 지루함 없이 빠져들면서 보고  시간이 언제 지났는지도 모르게 너무 재미있고 감동적으로 봤습니다   정말 추천합니다    
루카,뻔한 스토리 같지만 뻔하지 않은 감동이 있었슴   마지막엔 눈가를 적실만한 감동도     간만에 아이와 함께 즐긴 행복한 영화   
루카,아들들이랑 정말 잼있게 봤네요  재미도 있고 감동도 있고 아름다운 영상미에 시원한 여름배경   한번더 보고 싶네요 강추합니다 
루카,경계를 허물수록 커지는 우정
루카,픽사가 픽사했다  무슨 말이 필요하랴  
루카,디즈니 플러스로 봤는데 픽사 애니메이션에 첨으로 실망    시나리오가 좀 약함  
루카,강추강추 입니다  넘 잼있게 봤습니다 어른이 봐도 잼있는 애니메이션
루카,물고기소년 루카가 자신의 몸에 물이 없으면 사람처럼 변한다는 사실을 알게되고 낯선 해안가 마을에 친구인 알베르토와 함께 가면서 벌어지는 이야기  베스파란 이태리식 바이크를 사기위해 줄리아란 씩씩한 소녀와 함께 포르토로소컵에 나가기로 한 세명의 아이  이후 다양한 이야기가 펼쳐진다  그림이 예쁘고 캐릭터의 매력도 있는 올시즌 디즈니애니  다 볼때까지 정말 잼있었습니다 
루카,  
루카,픽사의 상상력  새로운 세계가 궁금한 루카의 모험기가 재미있다   이방인이라는 중요한 주제를 그리긴 했는데  그 갈등이 너무 쉽게 해소되었다는 게 아쉽다 
루카,완벽하게 따스하다  색감도 주제도 무엇보다 가족에 대한 사랑이 너무나 따스하다  다만 흠이 하나 있다면 친구인 알베르토를 형으로 자막처리한 점  그거 빼곤 완벽했다
루카,너무 감동적이고 재밌었어요  강력 추천합니다 
루카, 나를봐  나를봐  내안의 브루노가 이렇게 커졌어  알베르토      도시에서 실험소에 잡혀간 루카의 편지에서 
루카,루카  알베르토  줄리아  몇몇 장면들은 실사같았어요   특히 파도 장면  넘 예뻐서 놀랐네요    시원한 풍경에 힐링 됐어요   
루카,               동어반복인 줄 알았는데 소수자 서사까지 따뜻하게 끌어안는다
루카,그림은 예쁘고 스토리는 재밌지만 소수자옹호세뇌물이라서 거부감이 든다 
루카,      갈등의 폭발과 해결이 마지막에 몰아서 급하게 마무리되는 것이 아쉽다  그 외에는 만족  마키아벨리가 귀엽다  쿠키 있음 
루카,말미에 쿠키있음    시원한 여름배경의 영상이 좋았고  다른 존재에 대한 배려심과 유쾌한 우정의 모험극이었어요  
루카,랜선 이탈리아 바다 여행 느낌    힐링힐링 빨리 개봉했으면
루카,   이탈리아 바다 너무 힐링    휴가 다녀옴 느낌  
루카,픽사는 못참지
루카,영화가 청량하고 싱그럽다   
루카,기대중  
루카,진심으로 자연이 그리운 한 소년의 이야기     진심으로 사랑해요    
루카,하      진짜 색감 배경 분위기 캐릭터  박자 딱 맞아 떨어짐    포스터 소장각임    
루카,피트닥터 사랑해 평생 애니메이션 만들어줘
루카,여름을 기다리는 유일한 이유
루카,이것은  점이아닌   점을 주고싶은 제마음을 표현한 별점입니다       
루카,싱그러운 바닷가  코로나시국에 맑은 자연이 그립다 
캐시트럭,흥미진진한 초반부에 비해 뒤로 갈수록 늘어진다  주인공을 제대로 활용하지 못한 느낌
캐시트럭,  
캐시트럭,감독이 시카리오를 감명깊게 본 듯  하네요  조쉬하트넷은 단역 정도
캐시트럭,제이슨 팬이지만 제이슨보다 주인공역이 너무 멋짐 제이슨판  격투액션은 없음   스토리가 너무 탄탄 좋네요 확실한 복수 자식 사망진단서  그거에 따라 그대로 총쏘는데 전율        너의간 너의폐       는  손안되고 코풀고
캐시트럭,멋부리다   결말 놓친 감독 
캐시트럭,굿 
캐시트럭, 
캐시트럭,간지폭발
캐시트럭,제이슨 영화 중에 가장 비장하고 슬프면서도 짜임새 있는 영화가 아닌가 싶다 
캐시트럭,가이리치 특유의 연출과 제이슨 스타덤의 액션 연기 최고의 듀엣
캐시트럭,무적 스타뎀의 부활 후 후반부 총격 액션씬은 볼만  
캐시트럭,비록 몸으로 쓰는 액션씬이 아닌 총격씬이었지만 스타뎀 형님의 분위기는 뭘 하든 압도되는듯  스토리는 진부할 수 있겠지만 연기력과 연출력으로 흥미있게 끌어간 영화라고 생각함 
캐시트럭,제이슨 터미네이터
캐시트럭,우리 조쉬가 그얼굴 그몸을 하고 저런역할이라니   후속편에서 포텐 터트려줘
캐시트럭,이 배우 영화는 거의 다 믿고 봐도 된다는    과함이 없는 액션도 좋고 줄거리 또한 나쁘지 않다  간만에 몰입해서 봄     
캐시트럭,기대보다 재밌는데 
캐시트럭,제이슨 스타뎀의 액션을 바라는 습관으로 인한 이질감만 극복한다면 꽤나 짜임새 있는 구조가 긴장감으로 응수한다  몇 개의 문제와 답을 보여 주고 하나로 귀결되는 과정에서 몰입감이나 나름의 공식을 잘 지켜나가는 안정감은 가이리치 특유의 섬세한 조각이 빛을 발하는데 만족하기로 하자  그것만으로 개연성은 관대해 진다 
캐시트럭,뭔내용임  총질당해서 누워있다 갑자기 소파에  앉아있네 결말최악 영화보다 오랜만에  화났음
캐시트럭,역시 믿고보는 스타뎀표 액션  재미없었던적이 없다
캐시트럭,제법 몰입감 괜찮은 범죄 영화 
캐시트럭,역시 제이슨 스타뎀은 대사가 적어야  제 맛
캐시트럭,근데 다시 살아난건가  뭐야  불친절한 영화
캐시트럭,뭔 역할을 해도  제이슨 스타뎀이네
캐시트럭,좋아햇던 그시절의 제이슨으로 돌아왔네
캐시트럭,낫 배드  근데    은 너무 시카리오 느낌 따라한 듯     
캐시트럭,나름 재밌게봤지만 뭔가 허무하다고나할까  제이슨스타뎀영화치고 무거운느낌이라 좋았고 소재도 나름 나쁘지않았는데 중간에 시간맞추려했는지 잘려나간듯 연결이안되는부분들이  좀 있네      스타뎀은 무슨조직의 보스인거야  심부름센터의 보스인건가  왜 그사건현장서 망을봤던건지      망을 봐달라한 부하는 뭐였는지  사건에 큰영향을 끼친거같은데 왜 스타뎀은 그를 가만놔둔건지      스타뎀은 어떻게 살았는지 어떻게 거길 찾아간건지   보면서 왠지 그럴거같긴했는데 으잉  하던 부분들이다  이부분들은 짜집기에서 잘린건지 아니면 그저그런 범죄영화를 만들기위해 시나리오에서 제외된건지   
캐시트럭,내로남불영화네 자기아들 목숨만 귀하냐
캐시트럭,뻔한 스토리를 이렇게 재미나게 연출하다니   제이슨의 눈빛연기가 넘 인상적이네요 
캐시트럭,잔인해도 영화니깐   속 시원한 총질에 스트레스는 날아가나     인정사정 없는 총질에 비해 복수는 너무나도 담백하게    
캐시트럭,복수는 끝냈지만 부모마음으로는 가슴이 찢어질듯요  다시는 만날 수 없으니  액션과 긴장감까지 너무나 쫄깃하게 잘 봤습니다  시간적 설명으로 인물과 배경설명으로 이해하며  재밌게 봤네요  보스는 보스인듯요  오랜만에  재밌는 액션영화였습니다    점드렸네요
캐시트럭,범죄도시  보고 이거 봤는데 이게 더 재밌네요
캐시트럭,액션이 나쁘지 않지만 중반이 지루한게 흠 
캐시트럭,자식에 대한 무한한 애정과 집착    잔잔하게 흐르는 분위기속의 무게감이 그럭저럭 괜찮았다 
캐시트럭, 
캐시트럭,제이슨의 액션은 과하면서도 전혀 그렇게 느켜지지않는다 강한 카리스마가잇다 액션으론 일급니다 결국은 아들의 원수를 갚기위한거였네  하지만 불사신도 아니고 그많은 총알을 맞고도 살아남다니 크린트이스트우드아들의 미미한 존재감 조쉬역시 왜 나온겨
캐시트럭,구성이 좀 엉성하다
캐시트럭,역시 믿고 보는 재이슨형님의 액션영화 보는내내 긴장감과 몰입감을 주었다   조시하트넷은 왜 나온걸까
캐시트럭,아니  의상 핏이 장난 아님  돌덩이 같은 근육질감  액션 좋고 스토리 구성  전개도 좋았어요      죄없는 이들이 너무 많이 죽어서 그게 쫌    
캐시트럭,액션 장난 아니에요  그런데 조쉬 허트넷은 왜      
캐시트럭,쵝오
캐시트럭,꽤 잘 만들었네    시간 가는줄 모르고 봤네 
캐시트럭,요즘 만든 영화중에 이만한게 있나 다들 시간 아깝다는 생각만 들던중에    시간 아깝지 않은 제이슨형님 오랫만에 엄지척   
캐시트럭,스태덤의 액션은 여전히 통쾌하지만  방탄이 암만 좋아 봤자지  무슨 총을 그렇게 맞아도 멀쩡하기만 하냐 
캐시트럭,도시는 조용하다
캐시트럭,제이슨 좋아 하는데 미국 영화가 점점 재미가  없어지네요  중국무술 영화처럼 내용은 없고 정의도 없고 총 광고 영화 같네요
캐시트럭,이해가 안가서 여기에 남긴다  무장강도를 싫어하는 제이슨이 아들과 함께 있을때 조직원의 부탁을 들어 줘서 현금수송차 이동 하는것을  망보러 갔을까   자신은 그런일에 관여 했으면서 왜 아들 복수를 위해 강도들을 응징하면서 강도들을 쓰레기 취급 
캐시트럭,너무나  집중해서 보았어요 
캐시트럭,정말 솔직히 평가합니다  내가 본 영화 중 최악의 영화입니다  액션영화가 이렇게 졸릴 수도 있다는 게 놀랍습니다  가족 모두 영화 시청하다고 숙면했습니다 
캐시트럭,하여간 가이리치  서사 겁나 공들이는거 너무 티나  음악도 시카리오    비슷하게 만들고  
캐시트럭,강도보스의 복수극 늘그렇듯이  지 아들 복수를 위해선 어떤짓도 서슴지않는 잔인함이  그지같다
캐시트럭,이게 왜 끝이 허무하다는거지  존잼
캐시트럭,뭐냐 이게
캐시트럭,역쉬 제이슨 스타텀의 액션은 볼먼하네  
캐시트럭,이게 왜 평이 좋은건지 이해가 안됨   가이리치가  급영화를 만드는걸 보니 마음이 그렇구나   한때 스타일리시했는데 이제는 클리쉐에 너무 뻔하고 긴장감없는 영화가 되버림  기대하고 본 시간이 아까움 
캐시트럭,올레티비로     원 내고 봣다가 친구한테 개욕 처먹었다
캐시트럭,재미있게 봤는데 스테이덤 형님의 액션은 많이 나오지 않지만 나이도 있으시니 쉽게 쉽게 총으로 끝내는 시는군요 
캐시트럭,조금 아쉽다만 그럼에도 불구하고 볼만합니다
캐시트럭,지루하지는  않은데  그까짓  돈이  뭐라고  저렇게  사람을 시종일관  죽이는건지  이해가  안된다 머니  우상주의에  다들  중독된건  아닌지
캐시트럭,본 얼티메이텀 이후로 제일 재밌게 본 액션영화  물론 본 얼티메이텀과 직접적으로 비교하면 좀 그렇지만 그래도 이 정도면 충분히 훌륭한 액션영화다 
캐시트럭,기대없이  봤는데 간만에 스토리  구성 탄탄한 미국 영화였다 늘 분노과잉이던 배우도 그게 아니라 좋았다 한국영화같은 미국영화였다는   
캐시트럭,스토리는 뻔하지만 풀어내는 연출력이 확실히 다릅니다  역시 가이 리치 감독   
캐시트럭,멋있다
캐시트럭,마이크  오른팔 부하가 무장복면강도라니   힐 이눔도 겨우 강도질하는 놈들 보스였던거야  아들래미 죽인 그날도 결국 강도질하려고 사전조사 하려고 하다가 당한겨   뭐가 이리 시시해
캐시트럭,니암리슨 아이스로드   제이슨스타덤 캐시트럭   캐시트럭 승      간지나네잉  
캐시트럭,시원시원한 원샷은 좋은데   스릴러인데 스토리 전개가 너무 절차적인거 아님  게다가 끝에는 왜 건너뛰듯이 과정 생략하고 결론으로 치닫냐  마무리가 좀 허술해서 아쉽 
캐시트럭,통쾌하지 못한 타의적 다크나이트 
캐시트럭,살벌한 복수를 하는 영화  죽음엔 죽음으로     주인공의 분노가 느껴지고 복수를 완성하니 속이 후련하다 
캐시트럭,제이슨 형님 보고싶었습니다  이 영화는 제이슨 형님이 출연한다 더이상 무슨말이 필요한가
캐시트럭,깔끔하다   시간 동안 즐길수 있는영화
캐시트럭,뻔한 스토리긴 한데  총질이 재밌지
캐시트럭,웃음기 뺀 가이리치표 하드보일드  복수는 허무하다 
캐시트럭,던져놓은 떡밥의 부족한 회수와 시종일관 같은 배경음악의 반복
캐시트럭,평점이 짜네 재미있게 봤는데
캐시트럭,제이슨 스타뎀이 나와서 재미없는 영화는 없었다  하지만 이렇게 전후 짜임새가 완벽한 작품은 드물었다  절제된 표정으로 처절한 복수를 하는 연기가 일품  왠지 모르게 한국영화에서 흔히 볼 수 있었던 전개이지만  헐리웃식 해석과 연출이 더해지니 볼만하다  간만에 정말 괜찮은 작품을 봤다  근데 조쉬 하트넷은 왜 나온거지    
캐시트럭,남자 남자 남자 영화
캐시트럭,이렇게 뜨거운 복수극이라니    
캐시트럭,로맨스와 우정따윈 없다  돈을 원하는 이와 가족의 복수를 원하는 자 뿐  말많은 것도 질색이니  대화는 총으로 한다  다소 산으로 가는 존윅에 쓰라린 속을 스타뎀이 뚫어주러 왔다  여태 봐왔던 영화 중에서 존윅 다음으로  캐릭터의 소비가 빠르다  그 이야기는 누가 누군지 외우고 관계 파악하느라 머리 굴릴 필요가 없다는 말이다  착하건 억울하건 야비하건 다 죽는다  복수 이외엔 관심없는 총격 액션이 불을 뿜는다   번외로 중간에 억울하게 당한 세력 들의 뒷배가 스타뎀에 보복하는 스토리라면 존윅이나  테이큰 같은 시리즈도 가능할 듯 싶다  한국이었다면 크라우드 펀딩이라도 해서 만들게 하고 싶은 마음이다 
캐시트럭,복수는   그것도 내새끼에 대한 복수는 더더욱 그렇게 하면 안되지요   최소한 빈센조처럼 해야      
캐시트럭,스타뎀 형님 멋있네요
캐시트럭,악당이 지 아들 목숨은 그리 아끼면서 딴 놈들 목숨은    악당을 영웅시하는 이런 스토리는 없어져야 하지 않나
캐시트럭,묵직하다
캐시트럭,가이 리치 영화는 스토리가 있는  마초가 있고  총격전 멋지고 느와르가 있는  제이슨 스타뎀 영화중에 젤 낫지 않나  액션은 역시 악당이 훌륭해야 실감나는  악당 스쿼드와 스콧 이스트우드 냉혈한 조연이 영화 재미를 살려준  간만에 액션 스릴러 향연 
캐시트럭,몸으로 부딪치는 액션은 없다   총질만 난무  그래도 볼만함 
캐시트럭,진한 누아르 영상이 영웅본색 생각나네    평점 태러 하려거든 영화를 보는 안목을 키우시요    썩 은 아니라도 꽤 잘만든 영화다   
캐시트럭,약간 아쉬운 설정과 급 전개가 황당함을 주지만 그 밖엔 좋았습니다 
캐시트럭,회수 안 한 떡밥이 좀 있지만 오락성만 보면 시간 때우기 딱 좋은 영화  
캐시트럭,뭐야
캐시트럭,제이슨 스타뎀 영화는 진리임  묻지도 말고 따지지도 말고 일단 볼 것  한순간도 지루할 틈 없이 몰입해서 봄 
캐시트럭,다들 제이슨 원맨쇼일 것을 알지만 이건 그중에서도 물건이네
캐시트럭,제이슨 스타뎀다운    제이슨 스타뎀답게 만든 영화   
캐시트럭,타임킬러용으로 제격이다  머 말할꺼없다  지루한현실에 두시간액션영화로는 제격이다
캐시트럭,역시 스타덤이다    길게 말하고 질질 빼는 게 없다    
캐시트럭,건너뛰지않고 끝까지 집중해서 봤으므로   점
캐시트럭,코로나라 총을 쏘며 돈 버는구나  범죄역할 조연들에게 돈을 나눠주는 게 매너가 아니지 싶다  세월 앞에 장사없다는 모습을 잘 봤다  
캐시트럭,나는 영화를 보러갔지  소설책을 보러 간 것이 아니었다고
캐시트럭,영화내내 어두운 분위기로    지루하진 않은데   결말이 좀 싱거운 느낌
캐시트럭,재밋게 잘본 액션 영화
캐시트럭,다른 어떤 액션영화보다  재밌게 봤다 시간 가는 줄 모르게
캐시트럭,기대됩니다 
캐시트럭,시간 보내기에는 좋군요  화려한 캐스팅   록스탁 의 가이리치가 그립네요 
캐시트럭,퍼즐 조각은 충분히 모아놨는데 제자리에 놓여있질 않아 어수선하고 붕 떠있는듯한 느낌   작품의 짜임새가 조금 아쉽다 
캐시트럭,무슨말이 더 필요할까  제이슨 스태텀과 가이리치의 만남이라니    록스탁 앤 투스모킹 배럴스 를 봤을때의 그 경이로움과는 비교할수 없으나 단  초도 눈을 뗄수없게 만들었다  최근    년간 본 어떤 영화보다도 최고임     테이큰의 리암니슨과 제이슨 스태텀의 가족은 건드리는게 아니다  최소    명은 죽어나간다   
캐시트럭,   
캐시트럭,코로나 위험을 무릅쓰고          로 봄    후회없이 잘 봤습니다  간만에 시 원한 액션영화   제이슨 엉아 역시 달라 
캐시트럭,이 배우로 이 정도밖에 찍을수 없다는 것에 찬사를 보낸다  보는 내내 미쳐 죽는 줄 
캐시트럭,어듭고 음울한  혈흔이 뒤엉켜  구분 수없는  하드 코어  액션
캐시트럭,가이리치와 제이슨스타뎀이 만들어낸 최악의 영화    제이슨스타뎀의 화려한 액션은 온데간데 없고 총만 쏘다 끝나고 영화의 어울리지 않는 음악과 창의성 없는 스토리  영화 중간중간 쓸데 없는 타임워프는 영화의 맥을 끊음  영화의 흐름도 매끄럽지 못함  영화제목처럼 내 주머니의 캐시를 훔쳐감  킬링타임용도 안됨   
캐시트럭,그냥 뭐랄까     기대보단 별로인듯   뭔가 참신한 액션이 기다려진다  스토리가 좀 진부한듯   
캐시트럭,제이슨이 군기가 빠졋네  그 흔한 발차기한번없이  총질 몇번으로 영화를 꽁으로 먹으려고 하네  영화도 말년병장처럼 타이트하거나 빠릿한 맛이 없네
캐시트럭,분노의  질주보고   이거도봣지만  스토리   권총  액션   연기력   완벽햇다  처음부터   이걸볼껄    
캐시트럭,화장실 가는것도 꾹 참고 볼 정도로 흥미진진 
캐시트럭,재밌게 잘 봤음
캐시트럭,뒤로 갈수록 엉성해지고 후반부와 결말도 아쉽다
